"cid_cod","cid_descr"
V403,V40.3 OCUPANTE NE ACID N-TRANS
V404,V40.4 PESSOA AO SUBIR OU DESCER DO VEIC
V405,V40.5 CONDUTOR ACID TRANS
V406,V40.6 PASSAGEIRO ACID TRANS
V407,V40.7 PESSOA VIAJANDO EXT VEIC ACID TRANS
V409,V40.9 OCUPANTE NE ACID TRANS
V41,V41   OCUP AUTOMOVEL TRAUM COLIS VEIC A PEDAL
V410,V41.0 CONDUTOR ACID N-TRANS
V411,V41.1 PASSAGEIRO ACID N-TRANS
V412,V41.2 PESSOA VIAJANDO EXT VEIC ACID N-TRANS
V413,V41.3 OCUPANTE NE ACID N-TRANS
V414,V41.4 PESSOA AO SUBIR OU DESCER DO VEIC
V415,V41.5 CONDUTOR ACID TRANS
V416,V41.6 PASSAGEIRO ACID TRANS
V417,V41.7 PESSOA VIAJANDO EXT VEIC ACID TRANS
V419,V41.9 OCUPANTE NE ACID TRANS
V42,V42   OCUP AUTOTRAUM COLIS OUTR VEIC MOT 2 3 RODAS
V420,V42.0 CONDUTOR ACID N-TRANS
V421,V42.1 PASSAGEIRO ACID N-TRANS
V422,V42.2 PESSOA VIAJANDO EXT VEIC ACID N-TRANS
V423,V42.3 OCUPANTE NE ACID N-TRANS
V424,V42.4 PESSOA AO SUBIR OU DESCER DO VEIC
V425,V42.5 CONDUTOR ACID TRANS
V426,V42.6 PASSAGEIRO ACID TRANS
V427,V42.7 PESSOA VIAJANDO EXT VEIC ACID TRANS
V429,V42.9 OCUPANTE NE ACID TRANS
V43,V43   OCUP AUTOMOV TRAUM COL AUTO PICKUP CAMINHON
V430,V43.0 CONDUTOR ACID N-TRANS
V431,V43.1 PASSAGEIRO ACID N-TRANS
V432,V43.2 PESSOA VIAJANDO EXT VEIC ACID N-TRANS
V433,V43.3 OCUPANTE NE ACID N-TRANS
V434,V43.4 PESSOA AO SUBIR OU DESCER DO VEIC
V435,V43.5 CONDUTOR ACID TRANS
V436,V43.6 PASSAGEIRO ACID TRANS
V437,V43.7 PESSOA VIAJANDO EXT VEIC ACID TRANS
V439,V43.9 OCUPANTE NE ACID TRANS
V44,V44   OCUP AUTOM TRAUM COLIS VEIC TRANS PESAD ONIB
V440,V44.0 CONDUTOR ACID N-TRANS
V441,V44.1 PASSAGEIRO ACID N-TRANS
V442,V44.2 PESSOA VIAJANDO EXT VEIC ACID N-TRANS
V443,V44.3 OCUPANTE NE ACID N-TRANS
V444,V44.4 PESSOA AO SUBIR OU DESCER DO VEIC
V445,V44.5 CONDUTOR ACID TRANS
V446,V44.6 PASSAGEIRO ACID TRANS
V447,V44.7 PESSOA VIAJANDO EXT VEIC ACID TRANS
V449,V44.9 OCUPANTE NE ACID TRANS
V45,V45   OCUP AUTOMOVEL TRAUM COLIS TREM VEIC FERROV
V450,V45.0 CONDUTOR ACID N-TRANS
V451,V45.1 PASSAGEIRO ACID N-TRANS
V452,V45.2 PESSOA VIAJANDO EXT VEIC ACID N-TRANS
V453,V45.3 OCUPANTE NE ACID N-TRANS
V454,V45.4 PESSOA AO SUBIR OU DESCER DO VEIC
V455,V45.5 CONDUTOR ACID TRANS
V456,V45.6 PASSAGEIRO ACID TRANS
V457,V45.7 PESSOA VIAJANDO EXT VEIC ACID TRANS
V459,V45.9 OCUPANTE NE ACID TRANS
V46,V46   OCUP AUTOMOV TRAUM COLIS OUTR VEIC N-MOTOR
V460,V46.0 CONDUTOR ACID N-TRANS
V461,V46.1 PASSAGEIRO ACID N-TRANS
V462,V46.2 PESSOA VIAJANDO EXT VEIC ACID N-TRANS
V463,V46.3 OCUPANTE NE ACID N-TRANS
V464,V46.4 PESSOA AO SUBIR OU DESCER DO VEIC
V465,V46.5 CONDUTOR ACID TRANS
V466,V46.6 PASSAGEIRO ACID TRANS
V467,V46.7 PESSOA VIAJANDO EXT VEIC ACID TRANS
V469,V46.9 OCUPANTE NE ACID TRANS
V47,V47   OCUP AUTOMOVEL TRAUM COLIS OBJ FIXO PARADO
V470,V47.0 CONDUTOR ACID N-TRANS
V471,V47.1 PASSAGEIRO ACID N-TRANS
V472,V47.2 PESSOA VIAJANDO EXT VEIC ACID N-TRANS
V473,V47.3 OCUPANTE NE ACID N-TRANS
V474,V47.4 PESSOA AO SUBIR OU DESCER DO VEIC
V475,V47.5 CONDUTOR ACID TRANS
V476,V47.6 PASSAGEIRO ACID TRANS
V477,V47.7 PESSOA VIAJANDO EXT VEIC ACID TRANS
V479,V47.9 OCUPANTE NE ACID TRANS
V48,V48   OCUP AUTOMOVEL TRAUM ACID TRANSP S/COLIS
V480,V48.0 CONDUTOR ACID N-TRANS
V481,V48.1 PASSAGEIRO ACID N-TRANS
V482,V48.2 PESSOA VIAJANDO EXT VEIC ACID N-TRANS
V483,V48.3 OCUPANTE NE ACID N-TRANS
V484,V48.4 PESSOA AO SUBIR OU DESCER DO VEIC
V485,V48.5 CONDUTOR ACID TRANS
V486,V48.6 PASSAGEIRO ACID TRANS
V487,V48.7 PESSOA VIAJANDO EXT VEIC ACID TRANS
V489,V48.9 OCUPANTE NE ACID TRANS
V49,V49   OCUP AUTOMOVEL TRAUM OUTR ACID TRANSP E NE
V490,V49.0 CONDUTOR COLIS OUTR VEIC NE MOT ACID N-TRANS
V491,V49.1 PASSAGEIRO COLIS OUTR VEIC NE MOT AC N-TRANS
V492,V49.2 OCUPANTE NE COLIS OUT VEIC NE MOT AC N-TRANS
V493,V49.3 OCUPANTE ACID NE E N-TRANS
V494,V49.4 CONDUTOR COLIS OUTR VEIC NE MOT ACID TRANS
V495,V49.5 PASSAGEIRO COLIS OUTR VEIC NE MOT ACID TRANS
V496,V49.6 OCUPANTE NE COLIS OUT VEIC NE MOT ACID TRANS
V498,V49.8 OCUPANTE OUTR ACID TRANS ESPEC
V499,V49.9 OCUPANTE ACID TRANS NE
V50,V50   OCUP CAMINHONETE TRAUM COLIS PEDESTRE ANIMAL
V500,V50.0 CONDUTOR ACID N-TRANS
V501,V50.1 PASSAGEIRO ACID N-TRANS
V502,V50.2 PESSOA VIAJANDO EXT VEIC ACID N-TRANS
V503,V50.3 OCUPANTE NE ACID N-TRANS
V504,V50.4 PESSOA AO SUBIR OU DESCER DO VEIC
V505,V50.5 CONDUTOR ACID TRANS
V506,V50.6 PASSAGEIRO ACID TRANS
V507,V50.7 PESSOA VIAJANDO EXT VEIC ACID TRANS
V509,V50.9 OCUPANTE NE ACID TRANS
V51,V51   OCUP CAMINHONETE TRAUM COLIS VEIC PEDAL
V510,V51.0 CONDUTOR ACID N-TRANS
V511,V51.1 PASSAGEIRO ACID N-TRANS
V512,V51.2 PESSOA VIAJANDO EXT VEIC ACID N-TRANS
V513,V51.3 OCUPANTE NE ACID N-TRANS
V514,V51.4 PESSOA AO SUBIR OU DESCER DO VEIC
V515,V51.5 CONDUTOR ACID TRANS
V516,V51.6 PASSAGEIRO ACID TRANS
V517,V51.7 PESSOA VIAJANDO EXT VEIC ACID TRANS
V519,V51.9 OCUPANTE NE ACID TRANS
V52,V52   OCUP CAMINHON TRAUM COLIS VEIC MOT 2 3 RODAS
V520,V52.0 CONDUTOR ACID N-TRANS
V521,V52.1 PASSAGEIRO ACID N-TRANS
V522,V52.2 PESSOA VIAJANDO EXT VEIC ACID N-TRANS
V523,V52.3 OCUPANTE NE ACID N-TRANS
V524,V52.4 PESSOA AO SUBIR OU DESCER DO VEIC
V525,V52.5 CONDUTOR ACID TRANS
V526,V52.6 PASSAGEIRO ACID TRANS
V527,V52.7 PESSOA VIAJANDO EXT VEIC ACID TRANS
V529,V52.9 OCUPANTE NE ACID TRANS
V53,V53   OCUP CAMINHON TRAUM COLIS AUTOMOV CAMINHON
V530,V53.0 CONDUTOR ACID N-TRANS
V531,V53.1 PASSAGEIRO ACID N-TRANS
V532,V53.2 PESSOA VIAJANDO EXT VEIC ACID N-TRANS
V533,V53.3 OCUPANTE NE ACID N-TRANS
V534,V53.4 PESSOA AO SUBIR OU DESCER DO VEIC
V535,V53.5 CONDUTOR ACID TRANS
V536,V53.6 PASSAGEIRO ACID TRANS
V537,V53.7 PESSOA VIAJANDO EXT VEIC ACID TRANS
V539,V53.9 OCUPANTE NE ACID TRANS
V54,V54   OCUP CAMINHON TRAUM COL VEIC TRANSP PES ONIB
V540,V54.0 CONDUTOR ACID N-TRANS
V541,V54.1 PASSAGEIRO ACID N-TRANS
V542,V54.2 PESSOA VIAJANDO EXT VEIC ACID N-TRANS
V543,V54.3 OCUPANTE NE ACID N-TRANS
V544,V54.4 PESSOA AO SUBIR OU DESCER DO VEIC
V545,V54.5 CONDUTOR ACID TRANS
V546,V54.6 PASSAGEIRO ACID TRANS
V547,V54.7 PESSOA VIAJANDO EXT VEIC ACID TRANS
V549,V54.9 OCUPANTE NE ACID TRANS
V55,V55   OCUP CAMINHON TRAUM COLIS TREM VEIC FERROV
V550,V55.0 CONDUTOR ACID N-TRANS
V551,V55.1 PASSAGEIRO ACID N-TRANS
V552,V55.2 PESSOA VIAJANDO EXT VEIC ACID N-TRANS
V553,V55.3 OCUPANTE NE ACID N-TRANS
V554,V55.4 PESSOA AO SUBIR OU DESCER DO VEIC
V555,V55.5 CONDUTOR ACID TRANS
V556,V55.6 PASSAGEIRO ACID TRANS
V557,V55.7 PESSOA VIAJANDO EXT VEIC ACID TRANS
V559,V55.9 OCUPANTE NE ACID TRANS
V56,V56   OCUP CAMINHONETE TRAUM COLIS OUTR VEIC N-MOT
V560,V56.0 CONDUTOR ACID N-TRANS
V561,V56.1 PASSAGEIRO ACID N-TRANS
V562,V56.2 PESSOA VIAJANDO EXT VEIC ACID N-TRANS
V563,V56.3 OCUPANTE NE ACID N-TRANS
V564,V56.4 PESSOA AO SUBIR OU DESCER DO VEIC
V565,V56.5 CONDUTOR ACID TRANS
V566,V56.6 PASSAGEIRO ACID TRANS
V567,V56.7 PESSOA VIAJANDO EXT VEIC ACID TRANS
V569,V56.9 OCUPANTE NE ACID TRANS
V57,V57   OCUP CAMINHONETE TRAUM COLIS OBJ FIXO PARADO
V570,V57.0 CONDUTOR ACID N-TRANS
V571,V57.1 PASSAGEIRO ACID N-TRANS
V572,V57.2 PESSOA VIAJANDO EXT VEIC ACID N-TRANS
V573,V57.3 OCUPANTE NE ACID N-TRANS
V574,V57.4 PESSOA AO SUBIR OU DESCER DO VEIC
V575,V57.5 CONDUTOR ACID TRANS
V576,V57.6 PASSAGEIRO ACID TRANS
V577,V57.7 PESSOA VIAJANDO EXT VEIC ACID TRANS
V579,V57.9 OCUPANTE NE ACID TRANS
V58,V58   OCUP CAMINHONETE TRAUM ACID TRANSP S/COLIS
V580,V58.0 CONDUTOR ACID N-TRANS
V581,V58.1 PASSAGEIRO ACID N-TRANS
V582,V58.2 PESSOA VIAJANDO EXT VEIC ACID N-TRANS
V583,V58.3 OCUPANTE NE ACID N-TRANS
V584,V58.4 PESSOA AO SUBIR OU DESCER DO VEIC
V585,V58.5 CONDUTOR ACID TRANS
V586,V58.6 PASSAGEIRO ACID TRANS
V587,V58.7 PESSOA VIAJANDO EXT VEIC ACID TRANS
V589,V58.9 OCUPANTE NE ACID TRANS
V59,V59   OCUP CAMINHONETE TRAUM OUTR ACID TRANSP NE
V590,V59.0 CONDUTOR COLIS OUTR VEIC NE MOT ACID N-TRANS
V591,V59.1 PASSAGEIRO COLIS OUTR VEIC NE MOT AC N-TRANS
V592,V59.2 OCUPANTE NE COLIS OUT VEIC NE MOT AC N-TRANS
V593,V59.3 OCUPANTE ACID NE E N-TRANS
V594,V59.4 CONDUTOR COLIS OUTR VEIC NE MOT ACID TRANS
V595,V59.5 PASSAGEIRO COLIS OUTR VEIC NE MOT ACID TRANS
V596,V59.6 OCUPANTE NE COLIS OUT VEIC NE MOT ACID TRANS
V598,V59.8 OCUPANTE OUTR ACID TRANS ESPEC
V599,V59.9 OCUPANTE ACID TRANS NE
V60,V60   OCUP VEIC TRANSP PESADO TRAUM COLIS PED ANIM
V600,V60.0 CONDUTOR ACID N-TRANS
V601,V60.1 PASSAGEIRO ACID N-TRANS
V602,V60.2 PESSOA VIAJANDO EXT VEIC ACID N-TRANS
V603,V60.3 OCUPANTE NE ACID N-TRANS
V604,V60.4 PESSOA AO SUBIR OU DESCER DO VEIC
V605,V60.5 CONDUTOR ACID TRANS
V606,V60.6 PASSAGEIRO ACID TRANS
V607,V60.7 PESSOA VIAJANDO EXT VEIC ACID TRANS
V609,V60.9 OCUPANTE NE ACID TRANS
V61,V61   OCUP VEIC TRANSP PESADO TRAUM COL VEIC PEDAL
V610,V61.0 CONDUTOR ACID N-TRANS
V611,V61.1 PASSAGEIRO ACID N-TRANS
V612,V61.2 PESSOA VIAJANDO EXT VEIC ACID N-TRANS
V613,V61.3 OCUPANTE NE ACID N-TRANS
V614,V61.4 PESSOA AO SUBIR OU DESCER DO VEIC
V615,V61.5 CONDUTOR ACID TRANS
V616,V61.6 PASSAGEIRO ACID TRANS
V617,V61.7 PESSOA VIAJANDO EXT VEIC ACID TRANS
V619,V61.9 OCUPANTE NE ACID TRANS
V62,V62   OCUP V TRANSP PES TRAUM COL VEIC MOT 2 3 ROD
V620,V62.0 CONDUTOR ACID N-TRANS
V621,V62.1 PASSAGEIRO ACID N-TRANS
V622,V62.2 PESSOA VIAJANDO EXT VEIC ACID N-TRANS
V623,V62.3 OCUPANTE NE ACID N-TRANS
V624,V62.4 PESSOA AO SUBIR OU DESCER DO VEIC
V625,V62.5 CONDUTOR ACID TRANS
V626,V62.6 PASSAGEIRO ACID TRANS
V627,V62.7 PESSOA VIAJANDO EXT VEIC ACID TRANS
V629,V62.9 OCUPANTE NE ACID TRANS
V63,V63   OCUP VEIC TR PESADO TRAUM COL AUTO CAMINHON
V630,V63.0 CONDUTOR ACID N-TRANS
V631,V63.1 PASSAGEIRO ACID N-TRANS
V632,V63.2 PESSOA VIAJANDO EXT VEIC ACID N-TRANS
V633,V63.3 OCUPANTE NE ACID N-TRANS
V634,V63.4 PESSOA AO SUBIR OU DESCER DO VEIC
V635,V63.5 CONDUTOR ACID TRANS
V636,V63.6 PASSAGEIRO ACID TRANS
V637,V63.7 PESSOA VIAJANDO EXT VEIC ACID TRANS
V639,V63.9 OCUPANTE NE ACID TRANS
V64,V64   OCUP V TR PES TR COL OUTR VEIC TR PES ONIB
V640,V64.0 CONDUTOR ACID N-TRANS
V641,V64.1 PASSAGEIRO ACID N-TRANS
V642,V64.2 PESSOA VIAJANDO EXT VEIC ACID N-TRANS
V643,V64.3 OCUPANTE NE ACID N-TRANS
V644,V64.4 PESSOA AO SUBIR OU DESCER DO VEIC
V645,V64.5 CONDUTOR ACID TRANS
V646,V64.6 PASSAGEIRO ACID TRANS
V647,V64.7 PESSOA VIAJANDO EXT VEIC ACID TRANS
V649,V64.9 OCUPANTE NE ACID TRANS
V65,V65   OCUP VEIC TR PES TRAUM COL TREM VEIC FERROV
V650,V65.0 CONDUTOR ACID N-TRANS
V651,V65.1 PASSAGEIRO ACID N-TRANS
V652,V65.2 PESSOA VIAJANDO EXT VEIC ACID N-TRANS
V653,V65.3 OCUPANTE NE ACID N-TRANS
V654,V65.4 PESSOA AO SUBIR OU DESCER DO VEIC
V655,V65.5 CONDUTOR ACID TRANS
V656,V65.6 PASSAGEIRO ACID TRANS
V657,V65.7 PESSOA VIAJANDO EXT VEIC ACID TRANS
V659,V65.9 OCUPANTE NE ACID TRANS
V66,V66   OCUP VEIC TR PESADO TRAUM COL OUT VEIC N-MOT
V660,V66.0 CONDUTOR ACID N-TRANS
V661,V66.1 PASSAGEIRO ACID N-TRANS
V662,V66.2 PESSOA VIAJANDO EXT VEIC ACID N-TRANS
V663,V66.3 OCUPANTE NE ACID N-TRANS
V664,V66.4 PESSOA AO SUBIR OU DESCER DO VEIC
V665,V66.5 CONDUTOR ACID TRANS
V666,V66.6 PASSAGEIRO ACID TRANS
V667,V66.7 PESSOA VIAJANDO EXT VEIC ACID TRANS
V669,V66.9 OCUPANTE NE ACID TRANS
V67,V67   OCUP VEIC TR PESADO TRAUM COL OBJ FIXO PARAD
V670,V67.0 CONDUTOR ACID N-TRANS
V671,V67.1 PASSAGEIRO ACID N-TRANS
V672,V67.2 PESSOA VIAJANDO EXT VEIC ACID N-TRANS
V673,V67.3 OCUPANTE NE ACID N-TRANS
V674,V67.4 PESSOA AO SUBIR OU DESCER DO VEIC
V675,V67.5 CONDUTOR ACID TRANS
V676,V67.6 PASSAGEIRO ACID TRANS
V677,V67.7 PESSOA VIAJANDO EXT VEIC ACID TRANS
V679,V67.9 OCUPANTE NE ACID TRANS
V68,V68   OCUP VEIC TR PESADO TRAUM AC TRANSP S/COLIS
V680,V68.0 CONDUTOR ACID N-TRANS
V681,V68.1 PASSAGEIRO ACID N-TRANS
V682,V68.2 PESSOA VIAJANDO EXT VEIC ACID N-TRANS
V683,V68.3 OCUPANTE NE ACID N-TRANS
V684,V68.4 PESSOA AO SUBIR OU DESCER DO VEIC
V685,V68.5 CONDUTOR ACID TRANS
V686,V68.6 PASSAGEIRO ACID TRANS
V687,V68.7 PESSOA VIAJANDO EXT VEIC ACID TRANS
V689,V68.9 OCUPANTE NE ACID TRANS
V69,V69   OCUP VEIC TR PESADO TRAUM OUTR AC TRANSP NE
V690,V69.0 CONDUTOR COLIS OUTR VEIC NE MOT ACID N-TRANS
V691,V69.1 PASSAGEIRO COLIS OUTR VEIC NE MOT AC N-TRANS
V692,V69.2 OCUPANTE NE COLIS OUT VEIC NE MOT AC N-TRANS
V693,V69.3 OCUPANTE ACID NE E N-TRANS
V694,V69.4 CONDUTOR COLIS OUTR VEIC NE MOT ACID TRANS
V695,V69.5 PASSAGEIRO COLIS OUTR VEIC NE MOT ACID TRANS
V696,V69.6 OCUPANTE NE COLIS OUT VEIC NE MOT ACID TRANS
V698,V69.8 OCUPANTE OUTR ACID TRANS ESPEC
V699,V69.9 OCUPANTE ACID TRANS NE
V70,V70   OCUP ONIBUS TRAUM COLIS PEDESTRE ANIMAL
V700,V70.0 CONDUTOR ACID N-TRANS
V701,V70.1 PASSAGEIRO ACID N-TRANS
V702,V70.2 PESSOA VIAJANDO EXT VEIC ACID N-TRANS
V703,V70.3 OCUPANTE NE ACID N-TRANS
V704,V70.4 PESSOA AO SUBIR OU DESCER DO VEIC
V705,V70.5 CONDUTOR ACID TRANS
V706,V70.6 PASSAGEIRO ACID TRANS
V707,V70.7 PESSOA VIAJANDO EXT VEIC ACID TRANS
V709,V70.9 OCUPANTE NE ACID TRANS
V71,V71   OCUP ONIBUS TRAUM COLIS VEIC A PEDAL
V710,V71.0 CONDUTOR ACID N-TRANS
V711,V71.1 PASSAGEIRO ACID N-TRANS
V712,V71.2 PESSOA VIAJANDO EXT VEIC ACID N-TRANS
V713,V71.3 OCUPANTE NE ACID N-TRANS
V714,V71.4 PESSOA AO SUBIR OU DESCER DO VEIC
V715,V71.5 CONDUTOR ACID TRANS
V716,V71.6 PASSAGEIRO ACID TRANS
V717,V71.7 PESSOA VIAJANDO EXT VEIC ACID TRANS
V719,V71.9 OCUPANTE NE ACID TRANS
V72,V72   OCUP ONIBUS TRAUM COL OUT VEIC MOT 2 3 RODAS
V720,V72.0 CONDUTOR ACID N-TRANS
V721,V72.1 PASSAGEIRO ACID N-TRANS
V722,V72.2 PESSOA VIAJANDO EXT VEIC ACID N-TRANS
V723,V72.3 OCUPANTE NE ACID N-TRANS
V724,V72.4 PESSOA AO SUBIR OU DESCER DO VEIC
V725,V72.5 CONDUTOR ACID TRANS
V726,V72.6 PASSAGEIRO ACID TRANS
V727,V72.7 PESSOA VIAJANDO EXT VEIC ACID TRANS
V729,V72.9 OCUPANTE NE ACID TRANS
V73,V73   OCUP ONIBUS TRAUM COLIS AUTOMOVEL CAMINHONET
V730,V73.0 CONDUTOR ACID N-TRANS
V731,V73.1 PASSAGEIRO ACID N-TRANS
V732,V73.2 PESSOA VIAJANDO EXT VEIC ACID N-TRANS
V733,V73.3 OCUPANTE NE ACID N-TRANS
V734,V73.4 PESSOA AO SUBIR OU DESCER DO VEIC
V735,V73.5 CONDUTOR ACID TRANS
V736,V73.6 PASSAGEIRO ACID TRANS
V737,V73.7 PESSOA VIAJANDO EXT VEIC ACID TRANS
V739,V73.9 OCUPANTE NE ACID TRANS
V74,V74   OCUP ONIBUS TRAUM COLIS VEIC TRANSP PES ONIB
V740,V74.0 CONDUTOR ACID N-TRANS
V741,V74.1 PASSAGEIRO ACID N-TRANS
V742,V74.2 PESSOA VIAJANDO EXT VEIC ACID N-TRANS
V743,V74.3 OCUPANTE NE ACID N-TRANS
V744,V74.4 PESSOA AO SUBIR OU DESCER DO VEIC
V745,V74.5 CONDUTOR ACID TRANS
V746,V74.6 PASSAGEIRO ACID TRANS
V747,V74.7 PESSOA VIAJANDO EXT VEIC ACID TRANS
V749,V74.9 OCUPANTE NE ACID TRANS
V75,V75   OCUP ONIBUS TRAUM COLIS TREM VEIC FERROV
V750,V75.0 CONDUTOR ACID N-TRANS
V751,V75.1 PASSAGEIRO ACID N-TRANS
V752,V75.2 PESSOA VIAJANDO EXT VEIC ACID N-TRANS
V753,V75.3 OCUPANTE NE ACID N-TRANS
V754,V75.4 PESSOA AO SUBIR OU DESCER DO VEIC
V755,V75.5 CONDUTOR ACID TRANS
V756,V75.6 PASSAGEIRO ACID TRANS
V757,V75.7 PESSOA VIAJANDO EXT VEIC ACID TRANS
V759,V75.9 OCUPANTE NE ACID TRANS
V76,V76   OCUP ONIBUS TRAUM COLIS OUTR VEIC N-MOTOR
V760,V76.0 CONDUTOR ACID N-TRANS
V761,V76.1 PASSAGEIRO ACID N-TRANS
V762,V76.2 PESSOA VIAJANDO EXT VEIC ACID N-TRANS
V763,V76.3 OCUPANTE NE ACID N-TRANS
V764,V76.4 PESSOA AO SUBIR OU DESCER DO VEIC
V765,V76.5 CONDUTOR ACID TRANS
V766,V76.6 PASSAGEIRO ACID TRANS
V767,V76.7 PESSOA VIAJANDO EXT VEIC ACID TRANS
V769,V76.9 OCUPANTE NE ACID TRANS
V77,V77   OCUP ONIBUS TRAUM COLIS OBJETO FIXO PARADO
V770,V77.0 CONDUTOR ACID N-TRANS
V771,V77.1 PASSAGEIRO ACID N-TRANS
V772,V77.2 PESSOA VIAJANDO EXT VEIC ACID N-TRANS
V773,V77.3 OCUPANTE NE ACID N-TRANS
V774,V77.4 PESSOA AO SUBIR OU DESCER DO VEIC
V775,V77.5 CONDUTOR ACID TRANS
V776,V77.6 PASSAGEIRO ACID TRANS
V777,V77.7 PESSOA VIAJANDO EXT VEIC ACID TRANS
V779,V77.9 OCUPANTE NE ACID TRANS
V78,V78   OCUP ONIBUS TRAUM ACID TRANSP S/COLIS
V780,V78.0 CONDUTOR ACID N-TRANS
V781,V78.1 PASSAGEIRO ACID N-TRANS
V782,V78.2 PESSOA VIAJANDO EXT VEIC ACID N-TRANS
V783,V78.3 OCUPANTE NE ACID N-TRANS
V784,V78.4 PESSOA AO SUBIR OU DESCER DO VEIC
V785,V78.5 CONDUTOR ACID TRANS
V786,V78.6 PASSAGEIRO ACID TRANS
V787,V78.7 PESSOA VIAJANDO EXT VEIC ACID TRANS
V789,V78.9 OCUPANTE NE ACID TRANS
V79,V79   OCUP ONIBUS TRAUM OUTR ACID TRANSP E NE
V790,V79.0 CONDUTOR COLIS OUTR VEIC NE MOT ACID N-TRANS
V791,V79.1 PASSAGEIRO COLIS OUTR VEIC NE MOT AC N-TRANS
V792,V79.2 OCUPANTE NE COLIS OUT VEIC NE MOT AC N-TRANS
V793,V79.3 OCUPANTE ACID NE E N-TRANS
V794,V79.4 CONDUTOR COLIS OUTR VEIC NE MOT ACID TRANS
V795,V79.5 PASSAGEIRO COLIS OUTR VEIC NE MOT ACID TRANS
V796,V79.6 OCUPANTE NE COLIS OUT VEIC NE MOT ACID TRANS
V798,V79.8 OCUPANTE OUTR ACID TRANS ESPEC
V799,V79.9 OCUPANTE ACID TRANS NE
V80,V80   PESS MONT ANIM OC VEIC ANIM TRAUM AC TRANSP
V800,V80.0 ACID TRANS S/COLIS
V801,V80.1 COLIS PEDESTRE OU ANIMAL
V802,V80.2 COLIS OUTR VEIC A PEDAL
V803,V80.3 COLIS VEIC MOT DE 2 OU 3 RODAS
V804,V80.4 COLIS AUTOM CAMINHON VEIC TRANS PESAD ONIBUS
V805,V80.5 COLIS VEIC MOT ESPEC
V806,V80.6 COLIS TREM VEIC FERROVIARIO
V807,V80.7 COLIS OUTR VEIC N-MOT
V808,V80.8 COLIS OBJETO FIXO OU PARADO
V809,V80.9 OUTR ACID TRANSP E NE
V81,V81   OCUP TREM VEIC FERROVIARIO TRAUM ACID TRANSP
V810,V81.0 COLIS VEIC MOT ACID N-TRANS
V811,V81.1 COLIS VEIC MOT ACID TRANS
V812,V81.2 COLIS OU ATINGIDO MATERIAL RODANTE
V813,V81.3 COLIS OUTR OBJETO
V814,V81.4 PESSOA AO SUBIR OU DESCER TREM VEIC FERROV
V815,V81.5 QUEDA NO INTERIOR TREM VEIC FERROVIARIO
V816,V81.6 QUEDA TREM VEIC FERROVIARIO
V817,V81.7 DESCARRILHAMENTO S/COLIS ANTECEDENTE
V818,V81.8 OUTR ACID FERROVIARIO ESPEC
V819,V81.9 ACID FERROVIARIO NE
V82,V82   OCUP DE UM BONDE TRAUM ACID TRANSP
V820,V82.0 COLIS VEIC MOT ACID N-TRANS
V821,V82.1 COLIS VEIC MOT ACID TRANS
V822,V82.2 COLIS OU ATINGIDO MATERIAL RODANTE
V823,V82.3 COLIS OUTR OBJETO
V824,V82.4 PESSOA AO SUBIR OU DESCER BONDE
V825,V82.5 QUEDA NO INTERIOR BONDE
V826,V82.6 QUEDA BONDE
V827,V82.7 DESCARRILHAMENTO S/COLIS ANTECEDENTE
V828,V82.8 OUTR ACID TRANSP ESPEC
V829,V82.9 ACID TRANS NE
V83,V83   OCUP VEIC ESP MOT AREA IND TRAUM AC TRANSP
V830,V83.0 CONDUTOR ACID TRANS
V831,V83.1 PASSAGEIRO ACID TRANS
V832,V83.2 PESSOA VIAJANDO EXT VEIC ACID TRANS
V833,V83.3 OCUPANTE NE ACID TRANS
V834,V83.4 PESSOA AO SUBIR OU DESCER VEIC
V835,V83.5 CONDUTOR ACID N-TRANS
V836,V83.6 PASSAGEIRO ACID N-TRANS
V837,V83.7 PESSOA VIAJANDO EXT VEIC ACID N-TRANS
V839,V83.9 OCUPANTE NE ACID N-TRANS
V84,V84   OCUP VEIC ESP MOT USO AGRIC TRAUM ACID TRANS
V840,V84.0 CONDUTOR ACID TRANS
V841,V84.1 PASSAGEIRO ACID TRANS
V842,V84.2 PESSOA VIAJANDO EXT VEIC ACID TRANS
V843,V84.3 OCUPANTE NE ACID TRANS
V844,V84.4 PESSOA AO SUBIR OU DESCER VEIC
V845,V84.5 CONDUTOR ACID N-TRANS
V846,V84.6 PASSAGEIRO ACID N-TRANS
V847,V84.7 PESSOA VIAJANDO EXT VEIC ACID N-TRANS
V849,V84.9 OCUPANTE NE ACID N-TRANS
V85,V85   OCUP VEIC MOT ESP CONSTR TRAUM ACID TANSP
V850,V85.0 CONDUTOR ACID TRANS
V851,V85.1 PASSAGEIRO ACID TRANS
V852,V85.2 PESSOA VIAJANDO EXT VEIC ACID TRANS
V853,V85.3 OCUPANTE NE ACID TRANS
V854,V85.4 PESSOA AO SUBIR OU DESCER VEIC
V855,V85.5 CONDUTOR ACID N-TRANS
V856,V85.6 PASSAGEIRO ACID N-TRANS
V857,V85.7 PESSOA VIAJANDO EXT VEIC ACID N-TRANS
V859,V85.9 OCUPANTE NE ACID N-TRANS
V86,V86   OCUP VEIC OUTR USO N-VIA PUB TRAUM AC TRANSP
V860,V86.0 CONDUTOR ACID TRANS
V861,V86.1 PASSAGEIRO ACID TRANS
V862,V86.2 PESSOA VIAJANDO EXT VEIC ACID TRANS
V863,V86.3 OCUPANTE NE ACID TRANS
V864,V86.4 PESSOA AO SUBIR OU DESCER VEIC
V865,V86.5 CONDUTOR ACID N-TRANS
V866,V86.6 PASSAGEIRO ACID N-TRANS
V867,V86.7 PESSOA VIAJANDO EXT VEIC ACID N-TRANS
V869,V86.9 OCUPANTE NE ACID N-TRANS
V87,V87   ACID TRANS TIPO ESPEC DESCONH MOD TRANSP VIT
V870,V87.0 COLIS AUTOMOVEL E VEIC A MOTOR 2 3 RODAS
V871,V87.1 COLIS OUTR VEIC MOT E VEIC A MOTOR 2 3 RODAS
V872,V87.2 COLIS ENTRE AUTOMOVEL E CAMINHONETE
V873,V87.3 COLIS ENTRE AUTOMOVEL E ONIBUS
V874,V87.4 COLIS ENTRE AUTOMOVEL E VEIC TRANSP PESADO
V875,V87.5 COLIS ENTRE VEIC TRANSP PESADO E ONIBUS
V876,V87.6 COLIS ENTRE TREM VEIC FERROVIARIO E AUTOMOV
V877,V87.7 COLIS ENTRE OUTR VEIC MOT ESP
V878,V87.8 OUTR ACID TRANSP ESPEC VEIC MOTOR S/COLIS
V879,V87.9 OUTR ACID TRANSP ESPEC ENVOLV VEIC N-MOT
V88,V88   AC N-TRANS TIPO ESPEC DESCONH MOD TRANSP VIT
V880,V88.0 COLIS AUTOMOVEL E VEIC A MOTOR 2 3 RODAS
V881,V88.1 COLIS OUTR VEIC MOT E VEIC A MOTOR 2 3 RODAS
V882,V88.2 COLIS ENTRE AUTOMOVEL E CAMINHONETE
V883,V88.3 COLIS ENTRE AUTOMOVEL E ONIBUS
V884,V88.4 COLIS ENTRE AUTOMOVEL E VEIC TRANSP PESADO
V885,V88.5 COLIS ENTRE VEIC TRANSP PESADO E ONIBUS
V886,V88.6 COLIS ENTRE TREM VEIC FERROVIARIO E AUTOMOV
V887,V88.7 COLIS ENTRE OUTR VEIC MOT ESP
V888,V88.8 OUTR ACID TRANSP ESPEC VEIC MOTOR S/COLIS
V889,V88.9 OUTR ACID TRANSP ESPEC ENVOLV VEIC N-MOT
V89,V89   ACID VEIC MOT N-MOT TIPOS DE VEIC NE
V890,V89.0 ACID VEIC MOT NE N-TRANS
V891,V89.1 ACID VEIC N-MOT NE N-TRANS
V892,V89.2 ACID TRANS VEIC MOT NE
V893,V89.3 ACID TRANS VEIC N-MOT NE
V899,V89.9 ACID VEIC NE
V90,V90   ACID EMBARCACAO CAUS AFOGAMENTO SUBMERSAO
V900,V90.0 NAVIO MERCANTE
V901,V90.1 NAVIO DE PASSAGEIROS
V902,V90.2 BARCO DE PESCA
V903,V90.3 OUTR EMBARCACOES A MOTOR
V904,V90.4 BARCO A VELA
V905,V90.5 CAIAQUE OU CANOA
V906,V90.6 BOTE INFLAVEL
V907,V90.7 ESQUI AQUATICO
V908,V90.8 OUTR EMBARCACOES S/MOTOR
V909,V90.9 EMBARCACAO NE
V91,V91   ACID EMBARCACAO CAUSANDO OUTR TIPO DE TRAUM
V910,V91.0 NAVIO MERCANTE
V911,V91.1 NAVIO DE PASSAGEIROS
V912,V91.2 BARCO DE PESCA
V913,V91.3 OUTR EMBARCACOES A MOTOR
V914,V91.4 BARCO A VELA
V915,V91.5 CAIAQUE OU CANOA
V916,V91.6 BOTE INFLAVEL
V917,V91.7 ESQUI AQUATICO
V918,V91.8 OUTR EMBARCACOES S/MOTOR
V919,V91.9 EMBARCACAO NE
V92,V92   AFOG SUBMERS REL TRANSP AGUA S/ACID EMBARC
V920,V92.0 NAVIO MERCANTE
V921,V92.1 NAVIO DE PASSAGEIROS
V922,V92.2 BARCO DE PESCA
V923,V92.3 OUTR EMBARCACOES A MOTOR
V924,V92.4 BARCO A VELA
V925,V92.5 CAIAQUE OU CANOA
V926,V92.6 BOTE INFLAVEL
V927,V92.7 ESQUI AQUATICO
V928,V92.8 OUTR EMBARCACOES S/MOTOR
V929,V92.9 EMBARCACAO NE
V93,V93   ACID BORD EMB S/AC BEM N CAUS AFOG SUBMERS
V930,V93.0 NAVIO MERCANTE
V931,V93.1 NAVIO DE PASSAGEIROS
V932,V93.2 BARCO DE PESCA
V933,V93.3 OUTR EMBARCACOES A MOTOR
V934,V93.4 BARCO A VELA
V935,V93.5 CAIAQUE OU CANOA
V936,V93.6 BOTE INFLAVEL
V937,V93.7 ESQUI AQUATICO
V938,V93.8 OUTR EMBARCACOES S/MOTOR
V939,V93.9 EMBARCACAO NE
V94,V94   OUTR ACID TRANSP P/AGUA E OS NE
V940,V94.0 NAVIO MERCANTE
V941,V94.1 NAVIO DE PASSAGEIROS
V942,V94.2 BARCO DE PESCA
V943,V94.3 OUTR EMBARCACOES A MOTOR
V944,V94.4 BARCO A VELA
V945,V94.5 CAIAQUE OU CANOA
V946,V94.6 BOTE INFLAVEL
V947,V94.7 ESQUI AQUATICO
V948,V94.8 OUTR EMBARCACOES S/MOTOR
V949,V94.9 EMBARCACAO NE
V95,V95   ACID DE AERONAVE MOT CAUSANDO TRAUM AO OCUP
V950,V95.0 ACID DE HELICOPTERO CAUSANDO TRAUM A OCUP
V951,V95.1 ACID PLANADOR MOT ULTRALEVE CAUS TRAUM OCUP
V952,V95.2 ACID OUT AERON ASA FIX PART CAUS TRAUM OCUP
V953,V95.3 ACID AERON ASA FIXA COMERC CAUS TRAUM OCUP
V954,V95.4 ACID DE NAVE ESPACIAL CAUSANDO TRAUM A OCUP
V958,V95.8 OUTR ACID DE AERONAVES CAUSANDO TRAUM A OCUP
V959,V95.9 ACID DE AERONAVE NE CAUSANDO TRAUM A OCUP
V96,V96   ACID AERONAVE S/MOTOR CAUSANDO TRAUM A OCUP
V960,V96.0 ACID DE BALAO CAUSANDO TRAUM A OCUP
V961,V96.1 ACID DE ASA DELTA CAUSANDO TRAUM A OCUP
V962,V96.2 ACID DE PLANADOR CAUSANDO TRAUM A OCUP
V968,V96.8 OUTR ACID AERONAVES N-MOT CAUS TRAUM A OCUP
V969,V96.9 ACID NE AERONAVE N-MOT CAUS TRAUM A OCUP
V97,V97   OUTR ACID ESPEC DE TRANSPORTE AEREO
V970,V97.0 OCUP AERON TRAUM OUT ACID TRANSP AEREO ESPEC
V971,V97.1 PESSOA TRAUM EMBARCAR DESEMBARCAR AERONAVE
V972,V97.2 PARAQUEDISTA TRAUM ACID TRANSP AEREO
V973,V97.3 PESSOA EM TERRA TRAUM ACID TRANSP AEREO
V978,V97.8 OUTR ACID TRANSP AEREO NCOP
V98,V98   OUTR ACID TRANSP ESPEC
V99,V99   ACID TRANSP NE
W00,W00   QUEDA MESMO NIVEL ENVOLV GELO E NEVE
W000,W00.0 RESIDENCIA
W001,W00.1 HABITACAO COLETIVA
W002,W00.2 ESCOLAS OUTR INSTIT AREAS ADMIN PUBLICA
W003,W00.3 AREA P/A PRATICA DE ESPORTES E ATLETISMO
W004,W00.4 RUA E ESTRADA
W005,W00.5 AREAS DE COMERCIO E DE SERVICOS
W006,W00.6 AREAS INDUSTRIAIS E EM CONSTRUCAO
W007,W00.7 FAZENDA
W008,W00.8 OUTR LOCAIS ESPEC
W009,W00.9 LOCAL NE
W01,W01   QUEDA MESMO NIVEL ESCORR TROPEC PASSO FALSO
W010,W01.0 RESIDENCIA
W011,W01.1 HABITACAO COLETIVA
W012,W01.2 ESCOLAS OUTR INSTIT AREAS ADMIN PUBLICA
W013,W01.3 AREA P/A PRATICA DE ESPORTES E ATLETISMO
W014,W01.4 RUA E ESTRADA
W015,W01.5 AREAS DE COMERCIO E DE SERVICOS
W016,W01.6 AREAS INDUSTRIAIS E EM CONSTRUCAO
W017,W01.7 FAZENDA
W018,W01.8 OUTR LOCAIS ESPEC
W019,W01.9 LOCAL NE
W02,W02   QUEDA ENV PATINS RODAS GELO ESQUI PRANCH ROD
W020,W02.0 RESIDENCIA
W021,W02.1 HABITACAO COLETIVA
W022,W02.2 ESCOLAS OUTR INSTIT AREAS ADMIN PUBLICA
W023,W02.3 AREA P/A PRATICA DE ESPORTES E ATLETISMO
W024,W02.4 RUA E ESTRADA
W025,W02.5 AREAS DE COMERCIO E DE SERVICOS
W026,W02.6 AREAS INDUSTRIAIS E EM CONSTRUCAO
W027,W02.7 FAZENDA
W028,W02.8 OUTR LOCAIS ESPEC
W029,W02.9 LOCAL NE
W03,W03   OUTR QUED MESMO NIV COLIS EMPURRAO OUTR PESS
W030,W03.0 RESIDENCIA
W031,W03.1 HABITACAO COLETIVA
W032,W03.2 ESCOLAS OUTR INSTIT AREAS ADMIN PUBLICA
W033,W03.3 AREA P/A PRATICA DE ESPORTES E ATLETISMO
W034,W03.4 RUA E ESTRADA
W035,W03.5 AREAS DE COMERCIO E DE SERVICOS
W036,W03.6 AREAS INDUSTRIAIS E EM CONSTRUCAO
W037,W03.7 FAZENDA
W038,W03.8 OUTR LOCAIS ESPEC
W039,W03.9 LOCAL NE
W04,W04   QUEDA ENQUANTO CARREG APOIADO P/OUTR PESSOAS
W040,W04.0 RESIDENCIA
W041,W04.1 HABITACAO COLETIVA
W042,W04.2 ESCOLAS OUTR INSTIT AREAS ADMIN PUBLICA
W043,W04.3 AREA P/A PRATICA DE ESPORTES E ATLETISMO
W044,W04.4 RUA E ESTRADA
W045,W04.5 AREAS DE COMERCIO E DE SERVICOS
W046,W04.6 AREAS INDUSTRIAIS E EM CONSTRUCAO
W047,W04.7 FAZENDA
W048,W04.8 OUTR LOCAIS ESPEC
W049,W04.9 LOCAL NE
W05,W05   QUEDA ENVOLV UMA CADEIRA DE RODAS
W050,W05.0 RESIDENCIA
W051,W05.1 HABITACAO COLETIVA
W052,W05.2 ESCOLAS OUTR INSTIT AREAS ADMIN PUBLICA
W053,W05.3 AREA P/A PRATICA DE ESPORTES E ATLETISMO
W054,W05.4 RUA E ESTRADA
W055,W05.5 AREAS DE COMERCIO E DE SERVICOS
W056,W05.6 AREAS INDUSTRIAIS E EM CONSTRUCAO
W057,W05.7 FAZENDA
W058,W05.8 OUTR LOCAIS ESPEC
W059,W05.9 LOCAL NE
W06,W06   QUEDA DE UM LEITO
W060,W06.0 RESIDENCIA
W061,W06.1 HABITACAO COLETIVA
W062,W06.2 ESCOLAS OUTR INSTIT AREAS ADMIN PUBLICA
W063,W06.3 AREA P/A PRATICA DE ESPORTES E ATLETISMO
W064,W06.4 RUA E ESTRADA
W065,W06.5 AREAS DE COMERCIO E DE SERVICOS
W066,W06.6 AREAS INDUSTRIAIS E EM CONSTRUCAO
W067,W06.7 FAZENDA
W068,W06.8 OUTR LOCAIS ESPEC
W069,W06.9 LOCAL NE
W07,W07   QUEDA DE UMA CADEIRA
W070,W07.0 RESIDENCIA
W071,W07.1 HABITACAO COLETIVA
W072,W07.2 ESCOLAS OUTR INSTIT AREAS ADMIN PUBLICA
W073,W07.3 AREA P/A PRATICA DE ESPORTES E ATLETISMO
W074,W07.4 RUA E ESTRADA
