"cid_cod","cid_descr"
A00,A00   COLERA
A000,A00.0 COLERA DEV VIBRIO CHOLERAE 01 BIOT CHOLERAE
A001,A00.1 COLERA DEV VIBRIO CHOLERAE 01 BIOT EL TOR
A009,A00.9 COLERA NE
A01,A01   FEBRES TIFOIDE E PARATIFOIDE
A010,A01.0 FEBRE TIFOIDE
A011,A01.1 FEBRE PARATIFOIDE A
A012,A01.2 FEBRE PARATIFOIDE B
A013,A01.3 FEBRE PARATIFOIDE C
A014,A01.4 FEBRE PARATIFOIDE NE
A02,A02   OUTR INFECC P/SALMONELLA
A020,A02.0 ENTERITE P/SALMONELA
A021,A02.1 SEPTICEMIA P/SALMONELA
A022,A02.2 INFECC LOCALIZADAS P/SALMONELA
A028,A02.8 OUTR INFECC ESPEC P/SALMONELA
A029,A02.9 INFECC NE P/SALMONELA
A03,A03   SHIGUELOSE
A030,A03.0 SHIGUELOSE DEV SHIGELLA DYSENTERIAE
A031,A03.1 SHIGUELOSE DEV SHIGELLA FLEXNERI
A032,A03.2 SHIGUELOSE DEV SHIGELLA BOYDII
A033,A03.3 SHIGUELOSE DEV SHIGELLA SONNEI
A038,A03.8 OUTR SHIGUELOSES
A039,A03.9 SHIGUELOSE NE
A04,A04   OUTR INFECC INTESTINAIS BACTER
A040,A04.0 INFECC P/ESCHERICHIA COLI ENTEROPATOGENICA
A041,A04.1 INFECC P/ESCHERICHIA COLI ENTEROTOXIGENICA
A042,A04.2 INFECC P/ESCHERICHIA COLI ENTEROINVASIVA
A043,A04.3 INFECC P/ESCHERICHIA COLI ENTEROHEMORRAGICA
A044,A04.4 OUTR INFECC INTESTINAIS P/ESCHERICHIA COLI
A045,A04.5 ENTERITE P/CAMPYLOBACTER
A046,A04.6 ENTERITE DEV YERSINIA ENTEROCOLITICA
A047,A04.7 ENTEROCOLITE DEV CLOSTRIDIUM DIFFICILE
A048,A04.8 OUTR INFECC BACTER INTESTINAIS ESPEC
A049,A04.9 INFECC INTESTINAL BACTER NE
A05,A05   OUTR INTOX ALIMENTARES BACTER
A050,A05.0 INTOX ALIMENTAR ESTAFILOCOCICA
A051,A05.1 BOTULISMO
A052,A05.2 INTOX ALIMENTAR DEV CLOSTRIDIUM PERFRINGENS
A053,A05.3 INTOX ALIMENTAR DEV VIBRIO PARAHEMOLYTICUS
A054,A05.4 INTOX ALIMENTAR DEV BACILLUS CEREUS
A058,A05.8 OUTR INTOX ALIMENTARES BACTER ESPEC
A059,A05.9 INTOX ALIMENTAR BACTER NE
A06,A06   AMEBIASE
A060,A06.0 DISENTERIA AMEBIANA AGUDA
A061,A06.1 AMEBIASE INTESTINAL CRONICA
A062,A06.2 COLITE AMEBIANA NAO-DISENTERICA
A063,A06.3 AMEBOMA INTESTINAL
A064,A06.4 ABSCESSO AMEBIANO DO FIGADO
A065,A06.5 ABSCESSO AMEBIANO DO PULMAO
A066,A06.6 ABSCESSO AMEBIANO DO CEREBRO
A067,A06.7 AMEBIASE CUTANEA
A068,A06.8 INFECC AMEBIANA DE OUTR LOCALIZ
A069,A06.9 AMEBIASE NE
A07,A07   OUTR DOENC INTESTINAIS P/PROTOZOARIOS
A070,A07.0 BALANTIDIASE
A071,A07.1 GIARDIASE
A072,A07.2 CRIPTOSPORIDIOSE
A073,A07.3 ISOSPORIASE
A078,A07.8 OUTR DOENC INTESTINAIS ESPEC P/PROTOZOARIOS
A079,A07.9 DOENC INTESTINAL NE P/PROTOZOARIOS
A08,A08   INFECC INTESTINAIS VIRAIS OUTR E AS NE
A080,A08.0 ENTERITE P/ROTAVIRUS
A081,A08.1 GASTROENTEROPATIA AGUDA P/AGENTE DE NORWALK
A082,A08.2 ENTERITE P/ADENOVIRUS
A083,A08.3 OUTR ENTERITES VIRAIS
A084,A08.4 INFECC INTESTINAL DEV VIRUS NE
A085,A08.5 OUTR INFECC INTESTINAIS ESPEC
A09,A09   DIARREIA E GASTROENTERITE ORIG INFECC PRESUM
A15,A15   TUBERC RESPIRAT C/CONF BACTERIOL E HISTOLOG
A150,A15.0 TUBERC PULM C/CONF P/EX MICR EXPEC C/S/CULT
A151,A15.1 TUBERC PULMONAR C/CONF SOMENTE P/CULTURA
A152,A15.2 TUBERC PULMONAR C/CONF HISTOLOG
A153,A15.3 TUBERC PULMONAR C/CONF P/MEIO NE
A154,A15.4 TUBERC GANGL INTRATOR C/CONF BACTER E HISTOL
A155,A15.5 TUBERC LARING TRAQ BRONQ C/CONF BACT E HIST
A156,A15.6 PLEURIS TUBERC C/CONF BACTERIOL E HISTOLOG
A157,A15.7 TUBERC PRIM VIAS RESPIR C/CONF BACT E HISTOL
A158,A15.8 OUTR FORM TUBERC VIA RESP C/CONF BACT HIST
A159,A15.9 TUBERC NE VIAS RESPIR C/CONF BACTER HISTOL
A16,A16   TUBERC VIAS RESPIRAT S/CONF BACTER HISTOL
A160,A16.0 TUBERC PULMONAR C/EXAMES BACT E HIST NEGAT
A161,A16.1 TUBERC PULMONAR S/EXAME BACTER OU HISTOLOG
A162,A16.2 TUBERC PULMONAR S/MENC CONF BACT OU HIST
A163,A16.3 TUBERC GANGL INTRAT S/MENC CONF BACT HIST
A164,A16.4 TUBERC LARING TRAQ BRONQ S/MENC BACT HIST
A165,A16.5 PLEURISIA TUBERC S/MENC CONF BACT OU HISTOL
A167,A16.7 TUBERC RESPIR PRIM S/MENC CONF BACT OU HIST
A168,A16.8 OUTR TUBER VIA RESP S/MENC CONF BACT HIST
A169,A16.9 TUBERC RESPIRAT NE S/MENC CONF BACT OU HIST
A17,A17   TUBERC DO SIST NERVOSO
A170,A17.0 MENINGITE TUBERC
A171,A17.1 TUBERCULOMA MENINGEO
A178,A17.8 OUTR TUBERC DO SIST NERVOSO
A179,A17.9 TUBERC NE DO SIST NERVOSO
A18,A18   TUBERC DE OUTR ORGAOS
A180,A18.0 TUBERC OSSEA E DAS ARTICULACOES
A181,A18.1 TUBERC DO APARELHO GENITURINARIO
A182,A18.2 LINFADENOPATIA TUBERC PERIFERICA
A183,A18.3 TUBERC INTESTINO PERITONIO GANGL MESENTER
A184,A18.4 TUBERC DE PELE E TEC CELULAR SUBCUTANEO
A185,A18.5 TUBERC DO OLHO
A186,A18.6 TUBERC DO OUVIDO
A187,A18.7 TUBERC DAS SUPRA-RENAIS
A188,A18.8 TUBERC DE OUTR ORGAOS ESPEC
A19,A19   TUBERC MILIAR
A190,A19.0 TUBERC MILIAR AGUDA DE LOCALIZ UNICA ESPEC
A191,A19.1 TUBERC MILIAR AGUDA DE MULT LOCALIZ
A192,A19.2 TUBERC MILIAR AGUDA NE
A198,A19.8 OUTR TUBERC MILIARES
A199,A19.9 TUBERC MILIAR NE
A20,A20   PESTE
A200,A20.0 PESTE BUBONICA
A201,A20.1 PESTE CELULOCUTANEA
A202,A20.2 PESTE PNEUMONICA
A203,A20.3 PESTE MENINGEA
A207,A20.7 PESTE SEPTICEMICA
A208,A20.8 OUTR FORM DE PESTE
A209,A20.9 PESTE FORM NE
A21,A21   TULAREMIA
A210,A21.0 TULAREMIA ULCEROGLANDULAR
A211,A21.1 TULAREMIA OCULOGLANDULAR
A212,A21.2 TULAREMIA PULMONAR
A213,A21.3 TULAREMIA GASTROINTESTINAL
A217,A21.7 TULAREMIA GENERALIZADA
A218,A21.8 OUTR FORM DE TULAREMIA
A219,A21.9 TULAREMIA FORM NE
A22,A22   CARBUNCULO
A220,A22.0 CARBUNCULO CUTANEO
A221,A22.1 CARBUNCULO PULMONAR
A222,A22.2 CARBUNCULO GASTROINTESTINAL
A227,A22.7 SEPTICEMIA CARBUNCULOSA
A228,A22.8 OUTR FORM DE CARBUNCULO
A229,A22.9 CARBUNCULO FORM NE
A23,A23   BRUCELOSE
A230,A23.0 BRUCELOSE P/BRUCELLA MELITENSIS
A231,A23.1 BRUCELOSE P/BRUCELLA ABORTUS
A232,A23.2 BRUCELOSE P/BRUCELLA SUIS
A233,A23.3 BRUCELOSE P/BRUCELLA CANIS
A238,A23.8 OUTR BRUCELOSES
A239,A23.9 BRUCELOSE NE
A24,A24   MORMO E MELIOIDOSE
A240,A24.0 MORMO
A241,A24.1 MELIOIDOSE AGUDA E FULMINANTE
A242,A24.2 MELIOIDOSE SUBAGUDA E CRONICA
A243,A24.3 OUTR MELIOIDOSES
A244,A24.4 MELIOIDOSE NE
A25,A25   FEBRES TRANSM P/MORDEDURA DE RATO
A250,A25.0 ESPIRILOSE
A251,A25.1 ESTREPTOBACILOSE
A259,A25.9 FEBRE TRANSM P/MORDEDURA DE RATO TIPO NE
A26,A26   ERISIPELOIDE
A260,A26.0 ERISIPELOIDE CUTANEO
A267,A26.7 SEPTICEMIA P/ERYSIPELOTHRIX
A268,A26.8 OUTR FORM DE ERISIPELOIDE
A269,A26.9 ERISIPELOIDE NE
A27,A27   LEPTOSPIROSE
A270,A27.0 LEPTOPIROSE ICTEROHEMORRAGICA
A278,A27.8 OUTR FORM DE LEPTOSPIROSE
A279,A27.9 LEPTOSPIROSE NE
A28,A28   OUTR DOENC BACTER ZOONOTICAS NCOP
A280,A28.0 PASTEURELOSE
A281,A28.1 DOENC P/ARRANHADURA DO GATO
A282,A28.2 YERSINIOSE EXTRA-INTESTINAL
A288,A28.8 OUTR DOENC BACTER ZOONOTICAS ESPEC NCOP
A289,A28.9 DOENC BACTER ZOONOTICA NE
A30,A30   HANSENIASE
A300,A30.0 HANSENIASE INDETERMINADA
A301,A30.1 HANSENIASE TUBERCULOIDE
A302,A30.2 HANSENIASE TUBERCULOIDE BORDERLINE
A303,A30.3 HANSENIASE DIMORFA
A304,A30.4 HANSENIASE LEPROMATOSA BORDERLINE
A305,A30.5 HANSENIASE LEPROMATOSA
A308,A30.8 OUTR FORM DE HANSENIASE
A309,A30.9 HANSENIASE NE
A31,A31   INFECC DEV OUTR MICOBACTERIAS
A310,A31.0 INFECC PULMONAR MICOBACTERIANA
A311,A31.1 INFECC CUTANEA MICOBACTERIANA
A318,A31.8 OUTR INFECC MICOBACTERIANAS
A319,A31.9 INFECC MICOBACTERIANA NE
A32,A32   LISTERIOSE
A320,A32.0 LISTERIOSE CUTANEA
A321,A32.1 MENINGITE E MENINGOENCEFALITE P/LISTERIA
A327,A32.7 SEPTICEMIA LISTERIOTICA
A328,A32.8 OUTR FORM DE LISTERIOSE
A329,A32.9 LISTERIOSE NE
A33,A33   TETANO DO RECEM-NASCIDO
A34,A34   TETANO OBSTETRICO
A35,A35   OUTR TIPOS DE TETANO
A36,A36   DIFTERIA
A360,A36.0 DIFTERIA FARINGEA
A361,A36.1 DIFTERIA NASOFARINGEA
A362,A36.2 DIFTERIA LARINGEA
A363,A36.3 DIFTERIA CUTANEA
A368,A36.8 OUTR FORM DE DIFTERIA
A369,A36.9 DIFTERIA NE
A37,A37   COQUELUCHE
A370,A37.0 COQUELUCHE P/BORDETELLA PERTUSSIS
A371,A37.1 COQUELUCHE P/BORDETELLA PARAPERTUSSIS
A378,A37.8 COQUELUCHE P/OUTR ESPECIES DA BORDETELLA
A379,A37.9 COQUELUCHE NE
A38,A38   ESCARLATINA
A39,A39   INFECC MENINGOGOCICA
A390,A39.0 MENINGITE MENINGOCOCICA
A391,A39.1 SINDR DE WATERHOUSE-FRIDERICHSEN
A392,A39.2 MENINGOCOCCEMIA AGUDA
A393,A39.3 MENINGOCOCCEMIA CRONICA
A394,A39.4 MENINGOCOCCEMIA NE
A395,A39.5 CARDITE P/MENINGOCOCOS
A398,A39.8 OUTR INFECC P/MENINGOCOCOS
A399,A39.9 INFECC MENINGOCOCICA NE
A40,A40   SEPTICEMIA ESTREPTOCOCICA
A400,A40.0 SEPTICEMIA P/STREPTOCOCCUS DO GRUPO A
A401,A40.1 SEPTICEMIA P/STREPTOCOCCUS DO GRUPO B
A402,A40.2 SEPTICEMIA P/STREPTOCOCCUS DO GRUPO D
A403,A40.3 SEPTICEMIA P/STREPTOCOCCUS PNEUMONIA
A408,A40.8 OUTR SEPTICEMIAS ESTREPTOCOCICAS
A409,A40.9 SEPTICEMIA ESTREPTOCOCICA NE
A41,A41   OUTR SEPTICEMIAS
A410,A41.0 SEPTICEMIA P/STAPHYLOCOCCUS AUREUS
A411,A41.1 SEPTICEMIA P/OUTR ESTAFILOCOCOS ESPEC
A412,A41.2 SEPTICEMIA P/ESTAFILOCOCOS NE
A413,A41.3 SEPTICEMIA P/HAEMOPHILUS INFLUENZAE
A414,A41.4 SEPTICEMIA P/ANAEROBIOS
A415,A41.5 SEPTICEMIA P/OUTR MICROORG GRAM-NEGATIVOS
A418,A41.8 OUTR SEPTICEMIAS ESPEC
A419,A41.9 SEPTICEMIA NE
A42,A42   ACTINOMICOSE
A420,A42.0 ACTINOMICOSE PULMONAR
A421,A42.1 ACTINOMICOSE ABDOMINAL
A422,A42.2 ACTINOMICOSE CERVICOFACIAL
A427,A42.7 SEPTICEMIA ACTINOMICOTICA
A428,A42.8 OUTR FORM DE ACTINOMICOSE
A429,A42.9 ACTINOMICOSE NE
A43,A43   NOCARDIOSE
A430,A43.0 NOCARDIOSE PULMONAR
A431,A43.1 NOCARDIOSE CUTANEA
A438,A43.8 OUTR FORM DE NOCARDIOSE
A439,A43.9 NOCARDIOSE NE
A44,A44   BARTONELOSE
A440,A44.0 BARTONELOSE SISTEMICA
A441,A44.1 BARTONELOSE CUTANEA E CUTANEO-MUCOSA
A448,A44.8 OUTR FORM DE BARTONELOSE
A449,A44.9 BARTONELOSE NE
A46,A46   ERISIPELA
A48,A48   OUTR DOENC BACTER NCOP
A480,A48.0 GANGRENA GASOSA
A481,A48.1 DOENC DOS LEGIONARIOS
A482,A48.2 DOENC DOS LEGIONARIOS NAO-PNEUMONICA
A483,A48.3 SINDR DO CHOQUE TOXICO
A484,A48.4 FEBRE PURPURICA DO BRASIL
A488,A48.8 OUTR DOENC BACTER ESPEC
A49,A49   INFECC BACTER DE LOCAL NE
A490,A49.0 INFECC ESTAFILOCOCICA NE
A491,A49.1 INFECC ESTREPTOCOCICA NE
A492,A49.2 INFECC P/HAEMOPHILUS INFLUENZAE NE
A493,A49.3 INFECC P/MYCOPLASMA NE
A498,A49.8 OUTR INFECC BACTER DE LOCALIZ NE
A499,A49.9 INFECC BACTER NE
A50,A50   SIFILIS CONGEN
A500,A50.0 SIFILIS CONGEN PRECOCE SINTOMATICA
A501,A50.1 SIFILIS CONGEN PRECOCE FORM LATENTE
A502,A50.2 SIFILIS CONGEN PRECOCE NE
A503,A50.3 OCULOPATIA SIFILITICA CONGEN TARD
A504,A50.4 NEUROSSIFILIS CONGEN TARD
A505,A50.5 OUTR FORM TARD E SINTOMAT SIFILIS CONGEN
A506,A50.6 SIFILIS CONGEN TARD LATENTE
A507,A50.7 SIFILIS CONGEN TARD NE
A509,A50.9 SIFILIS CONGEN NE
A51,A51   SIFILIS PRECOCE
A510,A51.0 SIFILIS GENITAL PRIM
A511,A51.1 SIFILIS ANAL PRIM
A512,A51.2 SIFILIS PRIM DE OUTR LOCALIZ
A513,A51.3 SIFILIS SECUND DA PELE E DAS MUCOSAS
A514,A51.4 OUTR FORM DE SIFILIS SECUND
A515,A51.5 SIFILIS PRECOCE LATENTE
A519,A51.9 SIFILIS PRECOCE NE
A52,A52   SIFILIS TARD
A520,A52.0 SIFILIS CARDIOVASCULAR
A521,A52.1 NEUROSSIFILIS SINTOMATICA
A522,A52.2 NEUROSSIFILIS ASSINTOMATICA
A523,A52.3 NEUROSSIFILIS NE
A527,A52.7 OUTR FORM DE SIFILIS TARD SINTOMATICA
A528,A52.8 SIFILIS TARD LATENTE
A529,A52.9 SIFILIS TARD NE
A53,A53   OUTR FORM E AS NE DA SIFILIS
A530,A53.0 SIFILIS LATENTE NE SE RECENTE OU TARD
A539,A53.9 SIFILIS NE
A54,A54   INFECC GONOCOCICA
A540,A54.0 INF GON TR GENIT INF S/ABS PERIUR/GLAND ACES
A541,A54.1 INF GON TR GENIT INF C/ABS PERIUR/GLAND ACES
A542,A54.2 PELVIPERIT GONOC E OUTR INFECC GENITUR GONOC
A543,A54.3 INFECC GONOCOCICA DO OLHO
A544,A54.4 INFECC GONOCOCICA SIST MUSCULO-ESQUELETICO
A545,A54.5 FARINGITE GONOCOCICA
A546,A54.6 INFECC GONOCOCICA DO ANUS OU DO RETO
A548,A54.8 OUTR INFECC GONOCOCICAS
A549,A54.9 INFECC GONOCOCICA NE
A55,A55   LINFOGRANULOMA P/CLAMIDIA
A56,A56   OUTR INFECC P/CLAMIDIAS TRANSM P/VIA SEXUAL
A560,A56.0 INFECC P/CLAMIDIAS TRATO GENITURINARIO INFER
A561,A56.1 INFECC P/CLAMID PELVIPER E OUTR ORG GENITUR
A562,A56.2 INFECC P/CLAMIDIAS TRATO GENITUR LOCALIZ NE
A563,A56.3 INFECC DO ANUS E DO RETO P/CLAMIDIAS
A564,A56.4 INFECC DA FARINGE P/CLAMIDIAS
A568,A56.8 INFECC P/CLAMID TRANSM P/VIA SEX OUTR LOCAL
A57,A57   CANCRO MOLE
A58,A58   GRANULOMA INGUINAL
A59,A59   TRICOMONIASE
A590,A59.0 TRICOMONIASE UROGENITAL
A598,A59.8 OUTR LOCALIZ DE TRICOMONIASE
A599,A59.9 TRICOMONIASE NE
A60,A60   INFECC ANOGENITAIS P/VIRUS DO HERPES
A600,A60.0 INFECC ORG GENIT TRAT GENITUR P/VIRUS HERPES
A601,A60.1 INFECC MARGEM CUTAN ANUS/RETO P/VIRUS HERPES
A609,A60.9 INFECC ANOGENITAL NE P/VIRUS DO HERPES
A63,A63   OUTR DOENC DE TRANSM PREDOM SEXUAL NCOP
A630,A63.0 VERRUGAS ANOGENITAIS
A638,A63.8 OUTR DOENC ESPEC DE TRANSM PREDOM SEXUAL
A64,A64   DOENC SEXUALMENTE TRANSM NE
A65,A65   SIFILIS NAO-VENEREA
A66,A66   BOUBA
A660,A66.0 LESOES INICIAIS DA BOUBA
A661,A66.1 PAPILOMAS MULT E BOUBA PLANTAR UMIDA
A662,A66.2 OUTR LESOES CUTANEAS PRECOCES DA BOUBA
A663,A66.3 HIPERCERATOSE DEV BOUBA
A664,A66.4 GOMAS E ULCERAS DEV BOUBA
A665,A66.5 GANGOSA
A666,A66.6 LESOES OSTEOARTICULARES DEV BOUBA
A667,A66.7 OUTR MANIFESTACOES DA BOUBA
A668,A66.8 BOUBA LATENTE
A669,A66.9 BOUBA NE
A67,A67   PINTA
A670,A67.0 LESOES PRIM DA PINTA
A671,A67.1 LESOES INTERMEDIARIAS DA PINTA
A672,A67.2 LESOES TARD DA PINTA
A673,A67.3 LESOES MISTAS DA PINTA
A679,A67.9 PINTA NE
A68,A68   FEBRES RECORRENTES
A680,A68.0 FEBRE RECORRENTE TRANSM P/PIOLHOS
A681,A68.1 FEBRE RECORRENTE TRANSM P/CARRAPATOS
A689,A68.9 FEBRE RECORRENTE NE
A69,A69   OUTR INFECC P/ESPIROQUETAS
A690,A69.0 ESTOMATITE ULCERATIVA NECROTIZANTE
A691,A69.1 OUTR INFECC DE VINCENT
A692,A69.2 DOENC DE LYME
A698,A69.8 OUTR INFECC ESPEC P/ESPIROQUETAS
A699,A69.9 INFECC P/ESPIROQUETA NE
A70,A70   INFECC CAUSADAS P/CLAMIDIA PSITTACI
A71,A71   TRACOMA
A710,A71.0 FASE INICIAL DO TRACOMA
A711,A71.1 FASE ATIVA DO TRACOMA
A719,A71.9 TRACOMA NE
A74,A74   OUTR DOENC CAUSADAS P/CLAMIDIAS
A740,A74.0 CONJUNTIVITE CAUSADA P/CLAMIDIAS
A748,A74.8 OUTR DOENC CAUSADAS P/CLAMIDIAS
A749,A74.9 INFECC CAUSADA P/CLAMIDIAS NE
A75,A75   TIFO EXANTEMATICO
A750,A75.0 TIFO EPIDEM TRANSM P/PIOLHOS R. PROWAZEKII
A751,A75.1 TIFO RECRUDESCENTE
A752,A75.2 TIFO P/RICKETTSIA TYPHI
A753,A75.3 TIFO P/RICKETTSIA TSUTSUGAMUCHI
A759,A75.9 TIFO NE
A77,A77   FEBRE MACULOSA
A770,A77.0 FEBRE MACULOSA P/RICKETTSIA RICHETTSII
A771,A77.1 FEBRE MACULOSA P/RICKETTSIA CONORII
A772,A77.2 FEBRE MACULOSA DEV RICKETTSIA SIBERICA
A773,A77.3 FEBRE MACULOSA DEV RICKETTSIA AUSTRALIS
A778,A77.8 OUTR FEBRES MACULOSAS
A779,A77.9 FEBRE MACULOSA NE
A78,A78   FEBRE Q
A79,A79   OUTR RICKETTSIOSES
A790,A79.0 FEBRE DAS TRINCHEIRAS
A791,A79.1 RICKETTSIOSE VARICELIFORME DEV R.AKARI
A798,A79.8 OUTR TIPOS DE RICKETTSIOSES ESPEC
A799,A79.9 RICKETTSIOSE NE
A80,A80   POLIOMIELITE AGUDA
A800,A80.0 POLIOMIELITE PARAL AGUDA ASSOC VIRUS VACINAL
A801,A80.1 POLIOMIEL PARAL AGUDA VIRUS SELVAGEM IMPORT
A802,A80.2 POLIOMIEL PARAL AGUDA VIRUS SELVAGEM INDIG
A803,A80.3 POLIOMIELITES PARALITICAS AGUDAS OUTR E NE
A804,A80.4 POLIOMIELITE AGUDA NAO-PARALITICA
A809,A80.9 POLIOMIELITE AGUDA NE
A81,A81   INFECC P/VIRUS LENTOS SIST NERVOSO CENTRAL
A810,A81.0 DOENC DE CREUTZFELDT-JAKOB
A811,A81.1 PANENCEFALITE ESCLEROSANTE SUBAGUDA
A812,A81.2 LEUCOENCEFALOPATIA MULTIFOCAL PROGRESSIVA
A818,A81.8 OUTR INFECC P/VIRUS LENTOS SIST NERV CENTRAL
A819,A81.9 INFECC NE SIST NERV CENTRAL P/VIRUS LENTOS
A82,A82   RAIVA
A820,A82.0 RAIVA SILVESTRE
A821,A82.1 RAIVA URBANA
A829,A82.9 RAIVA NE
A83,A83   ENCEFALITE P/VIRUS TRANSM P/MOSQUITOS
A830,A83.0 ENCEFALITE JAPONESA
A831,A83.1 ENCEFALITE EQUINA OCIDENTAL
A832,A83.2 ENCEFALITE EQUINA ORIENTAL
A833,A83.3 ENCEFALITE DE ST. LOUIS
A834,A83.4 ENCEFALITE AUSTRALIANA
A835,A83.5 ENCEFALITE DA CALIFORNIA
A836,A83.6 DOENC P/VIRUS DE ROCIO
A838,A83.8 OUTR ENCEFALITES P/VIRUS TRANSM P/MOSQUITOS
A839,A83.9 ENCEFALITE NE P/VIRUS TRANSM P/MOSQUITOS
A84,A84   ENCEFALITE P/VIRUS TRANSM P/CARRAPATOS
A840,A84.0 ENCEFALITE DA TAIGA
A841,A84.1 ENCEFALITE EUROPA CENTRAL TRANSM P/CARRAPATO
A848,A84.8 OUTR ENCEFALITES P/VIRUS TRANSM P/CARRAPATOS
A849,A84.9 ENCEFALITE NE P/VIRUS TRANSM P/CARRAPATOS
A85,A85   OUTR ENCEFALITES VIRAIS NCOP
A850,A85.0 ENCEFALITE P/ENTEROVIRUS
A851,A85.1 ENCEFALITE P/ADENOVIRUS
A852,A85.2 ENCEFALITE P/VIRUS TRANSM P/ARTROPODES NE
A858,A85.8 OUTR ENCEFALITES VIRAIS ESPEC
A86,A86   ENCEFALITE VIRAL NE
A87,A87   MENINGITE VIRAL
A870,A87.0 MENINGITE P/ENTEROVIRUS
A871,A87.1 MENINGITE P/ADENOVIRUS
A872,A87.2 CORIOMENINGITE LINFOCITARIA
A878,A87.8 OUTR MENINGITES VIRAIS
A879,A87.9 MENINGITE VIRAL NE
A88,A88   OUTR INFECC VIRAIS SIST NERVOSO CENTRAL NCOP
A880,A88.0 FEBRE EXANTEMATICA P/ENTEROVIRUS
A881,A88.1 VERTIGEM EPIDEMICA
A888,A88.8 OUTR INFECC VIRAIS ESPEC SIST NERV CENTRAL
A89,A89   INFECC VIRAIS NE DO SIST NERVOSO CENTRAL
A90,A90   DENGUE
A91,A91   FEBRE HEMORRAGICA DEV VIRUS DO DENGUE
A92,A92   OUTR FEBRES VIRAIS TRANSM P/MOSQUITOS
A920,A92.0 FEBRE DE CHIKUNGUNYA
A921,A92.1 FEBRE DE ONYONG-NYONG
A922,A92.2 FEBRE EQUINA VENEZUELANA
A923,A92.3 FEBRE P/VIRUS WEST NILE
A924,A92.4 FEBRE DO VALE DO RIFT
A928,A92.8 OUTR FEBRES VIRAIS ESPEC TRANSM P/MOSQUITOS
A929,A92.9 FEBRE VIRAL TRANSM P/MOSQUITOS NE
A93,A93   OUTR FEBRES P/VIRUS TRANSM P/ARTROPODES NCOP
A930,A93.0 FEBRE DE OROPOUCHE
A931,A93.1 FEBRE P/FLEBOTOMOS
A932,A93.2 FEBRE DO COLORADO TRANSM P/CARRAPATOS
A938,A93.8 OUTR FEBRES VIRAIS ESPEC TRANSM P/ARTROPODES
A94,A94   FEBRE VIRAL TRANSM P/ARTROPODES NE
A95,A95   FEBRE AMARELA
A950,A95.0 FEBRE AMARELA SILVESTRE
A951,A95.1 FEBRE AMARELA URBANA
A959,A95.9 FEBRE AMARELA NE
A96,A96   FEBRE HEMORRAGICA P/ARENAVIRUS
A960,A96.0 FEBRE HEMORRAGICA DE JUNIN
A961,A96.1 FEBRE HEMORRAGICA DE MACHUPO
A962,A96.2 FEBRE DE LASSA
A968,A96.8 OUTR FEBRES HEMORRAGICAS P/ARENAVIRUS
A969,A96.9 FEBRE HEMORRAGICA P/ARENAVIRUS NE
A98,A98   OUTR FEBRES HEMORRAGICAS P/VIRUS NCOP
A980,A98.0 FEBRE HEMORRAGICA DA CRIMEIA
A981,A98.1 FEBRE HEMORRAGICA DE OMSK
A982,A98.2 DOENC DA FLORESTA DE KYASANUR
A983,A98.3 DOENC DE MARBURG
A984,A98.4 DOENC P/VIRUS EBOLA
A985,A98.5 FEBRE HEMORRAGICA C/SINDR RENAL
A988,A98.8 OUTR FEBRES HEMORRAGICAS ESPEC P/VIRUS
A99,A99   FEBRES HEMORRAGICAS VIRAIS NE
B00,B00   INFECC P/VIRUS DO HERPES
B000,B00.0 ECZEMA HERPETICO
B001,B00.1 DERMATITE VESICULAR DEV VIRUS DO HERPES
B002,B00.2 GENGIVOESTOM E FARINGOAMIG DEV VIRUS HERPES
B003,B00.3 MENINGITE DEV VIRUS DO HERPES
B004,B00.4 ENCEFALITE DEV VIRUS DO HERPES
B005,B00.5 AFECCOES OCULARES DEV VIRUS DO HERPES
B007,B00.7 DOENC DISSEMINADA DEV VIRUS DO HERPES
B008,B00.8 OUTR FORM DE INFECC DEV VIRUS DO HERPES
B009,B00.9 INFECC NE DEV VIRUS DO HERPES
B01,B01   VARICELA
B010,B01.0 MENINGITE P/VARICELA
B011,B01.1 ENCEFALITE P/VARICELA
B012,B01.2 PNEUMOPATIA VARICELOSA
B018,B01.8 VARICELA C/OUTR COMPLIC
B019,B01.9 VARICELA S/COMPLIC
B02,B02   HERPES ZOSTER
B020,B02.0 ENCEFALITE P/VIRUS DO HERPES ZOSTER
B021,B02.1 MENINGITE P/VIRUS DO HERPES ZOSTER
B022,B02.2 HERPES ZOSTER ACOMP OUTR MANIF NEUROLOGICAS
B023,B02.3 HERPES ZOSTER OFTALMICO
B027,B02.7 HERPES ZOSTER DISSEMINADO
B028,B02.8 HERPES ZOSTER C/OUTR COMPLIC
B029,B02.9 HERPES ZOSTER S/COMPLIC
B03,B03   VARIOLA
B04,B04   VARIOLA DOS MACACOS
B05,B05   SARAMPO
B050,B05.0 SARAMPO COMPLICADO P/ENCEFALITE
B051,B05.1 SARAMPO COMPLICADO P/MENINGITE
B052,B05.2 SARAMPO COMPLICADO P/PNEUMONIA
B053,B05.3 SARAMPO COMPLICADO P/OTITE MEDIA
B054,B05.4 SARAMPO C/COMPLIC INTESTINAIS
B058,B05.8 SARAMPO C/OUTR COMPLIC
B059,B05.9 SARAMPO S/COMPLIC
B06,B06   RUBEOLA
B060,B06.0 RUBEOLA C/COMPLIC NEUROLOGICAS
B068,B06.8 RUBEOLA C/OUTR COMPLIC
B069,B06.9 RUBEOLA S/COMPLIC
B07,B07   VERRUGAS ORIG VIRAL
B08,B08   OUTR INF VIRAIS LESOES PELE MEMBR MUC NCOP
B080,B08.0 OUTR INFECC P/ORTOPOXVIRUS
B081,B08.1 MOLUSCO CONTAGIOSO
B082,B08.2 EXANTEMA SUBITO
B083,B08.3 ERITEMA INFECC
B084,B08.4 ESTOMATITE VESIC DEV ENTEROVIRUS C/EXANTEMA
B085,B08.5 FARINGITE VESICULAR DEV ENTEROVIRUS
B088,B08.8 OUTR INF VIRAIS ESPEC LESOES PELE MEMBR MUCO
B09,B09   INF VIRAL NE CARACT P/LESOES PELE MEMBR MUCO
B15,B15   HEPATITE AGUDA A
B150,B15.0 HEPATITE A C/COMA HEPATICO
B159,B15.9 HEPATITE A S/COMA HEPATICO
B16,B16   HEPATITE AGUDA B
B160,B16.0 HEPATITE AGUDA B C/AGENTE DELTA C/COMA HEPAT
B161,B16.1 HEPATITE AGUDA B C/AGENTE DELTA S/COMA HEPAT
B162,B16.2 HEPATITE AGUDA B S/AGENTE DELTA C/COMA HEPAT
B169,B16.9 HEPATITE AGUDA B S/AGENTE DELTA S/COMA HEPAT
B17,B17   OUTR HEPATITES VIRAIS AGUDAS
B170,B17.0 INFECC DELTA AGUDA DE PORTADOR DE HEPATITE B
B171,B17.1 HEPATITE AGUDA C
B172,B17.2 HEPATITE AGUDA E
B178,B17.8 OUTR HEPATITES VIRAIS AGUDAS ESPEC
B18,B18   HEPATITE VIRAL CRONICA
B180,B18.0 HEPATITE VIRAL CRONICA B C/AGENTE DELTA
B181,B18.1 HEPATITE CRONICA VIRAL B S/AGENTE DELTA
B182,B18.2 HEPATITE VIRAL CRONICA C
B188,B18.8 OUTR HEPATITES CRONICAS VIRAIS
B189,B18.9 HEPATITE VIRAL CRONICA NE
B19,B19   HEPATITE VIRAL NE
B190,B19.0 HEPATITE VIRAL NE C/COMA
B199,B19.9 HEPATITE VIRAL NE S/COMA
B20,B20   DOENC P/HIV RESULT DOENC INFECC E PARASIT
B200,B20.0 DOENC P/HIV RESULT EM INFECC MICOBACTERIANAS
B201,B20.1 DOENC P/HIV RESULT OUTR INFECC BACTER
B202,B20.2 DOENC P/HIV RESULT EM DOENC CITOMEGALICA
B203,B20.3 DOENC P/HIV RESULT EM OUTR INFECC VIRAIS
B204,B20.4 DOENC P/HIV RESULT EM CANDIDIASE
B205,B20.5 DOENC P/HIV RESULT EM OUTR MICOSES
B206,B20.6 DOENC P/HIV RESULT PNEUMONIA P/P.CARINII
B207,B20.7 DOENC P/HIV RESULT EM INFECC MULT
B208,B20.8 DOENC P/HIV RESULT OUTR DOENC INFECC PARASIT
B209,B20.9 DOENC P/HIV RESULT DOENC INFECC PARASIT NE
B21,B21   DOENC P/HIV RESULT EM NEOPL MALIG
B210,B21.0 DOENC P/HIV RESULT EM SARCOMA DE KAPOSI
B211,B21.1 DOENC P/HIV RESULT EM LINFOMA DE BURKITT
B212,B21.2 DOENC P/HIV RES OUTR TIP LINFOMA NAO-HODGKIN
B213,B21.3 DOENC P/HIV OUT NEOP MAL TEC LINF HEMAT CORR
B217,B21.7 DOENC P/HIV RESULT EM MULT NEOPL MALIG
B218,B21.8 DOENC P/HIV RESULT EM OUTR NEOPL MALIG
B219,B21.9 DOENC P/HIV RESULT EM NEOPL MALIG NE
B22,B22   DOENC P/HIV RESULT EM OUTR DOENC ESPEC
B220,B22.0 DOENC P/HIV RESULT EM ENCEFALOPATIA
B221,B22.1 DOENC P/HIV RESULT PNEUMONITE INTERST LINFAT
B222,B22.2 DOENC P/HIV RESULT EM SINDR DE EMACIACAO
B227,B22.7 DOENC P/HIV RESULT EM DOENC MULT COP
B23,B23   DOENC P/HIV RESULT EM OUTR DOENC
B230,B23.0 SINDR DE INFECC AGUDA P/HIV
B231,B23.1 DOENC P/HIV RESULT LINFADENOPATIAS GENERALIZ
B232,B23.2 DOENC P/HIV RESULT ANOM HEMAT IMUNOLOG NCOP
B238,B23.8 DOENC P/HIV RESULT EM OUTR AFECCOES ESPEC
B24,B24   DOENC P/HIV NE
B25,B25   DOENC P/CITOMEGALOVIRUS
B250,B25.0 PNEUMONITE P/CITOMEGALOVIRUS
B251,B25.1 HEPATITE P/CITOMEGALOVIRUS
B252,B25.2 PANCREATITE P/CITOMEGALOVIRUS
B258,B25.8 OUTR DOENC P/CITOMEGALOVIRUS
B259,B25.9 DOENC NE P/CITOMEGALOVIRUS
B26,B26   CAXUMBA
B260,B26.0 ORQUITE P/CAXUMBA
B261,B26.1 MENINGITE P/CAXUMBA
B262,B26.2 ENCEFALITE P/CAXUMBA
B263,B26.3 PANCREATITE P/CAXUMBA
B268,B26.8 CAXUMBA C/OUTR COMPLIC
B269,B26.9 CAXUMBA S/COMPLIC
B27,B27   MONONUCLEOSE INFECC
B270,B27.0 MONONUCLEOSE P/VIRUS HERPES GAMA
B271,B27.1 MONONUCLEOSE P/CITOMEGALOVIRUS
B278,B27.8 OUTR MONONUCLEOSES INFECC
B279,B27.9 MONONUCLEOSE INFECC NE
B30,B30   CONJUNTIVITE VIRAL
B300,B30.0 CERATOCONJUNTIVITE DEV ADENOVIRUS
B301,B30.1 CONJUNTIVITE DEV ADENOVIRUS
B302,B30.2 FARINGOCONJUNTIVITE VIRAL
B303,B30.3 CONJUNTIVITE HEMORRAGICA AGUDA ENDEMICA
B308,B30.8 OUTR CONJUNTIVITES VIRAIS
B309,B30.9 CONJUNTIVITE VIRAL NE
B33,B33   OUTR DOENC P/VIRUS NCOP
B330,B33.0 MIALGIA EPIDEMICA
B331,B33.1 DOENC DE ROSS RIVER
B332,B33.2 CARDITE VIRAL
B333,B33.3 INFECC P/RETROVIRUS NCOP
B338,B33.8 OUTR DOENC ESPEC P/VIRUS
B34,B34   DOENC P/VIRUS DE LOCALIZ NE
B340,B34.0 INFECC P/ADENOVIRUS NE
B341,B34.1 INFECC P/ENTEROVIRUS NE
B342,B34.2 INFECC P/CORONAVIRUS NE
B343,B34.3 INFECC P/PARVOVIRUS NE
B344,B34.4 INFECC P/PAPOVAVIRUS NE
B348,B34.8 OUTR INFECC P/VIRUS DE LOCALIZ NE
B349,B34.9 INFECC VIRAL NE
B35,B35   DERMATOFITOSE
B350,B35.0 TINHA DA BARBA E DO COURO CABELUDO
B351,B35.1 TINHA DAS UNHAS
B352,B35.2 TINHA DA MAO
B353,B35.3 TINHA DOS PES
B354,B35.4 TINHA DO CORPO
B355,B35.5 TINHA IMBRICADA
B356,B35.6 TINEA CRURIS
B358,B35.8 OUTR DERMATOFITOSES
B359,B35.9 DERMATOFITOSE NE
B36,B36   OUTR MICOSES SUPERF
B360,B36.0 PITIRIASE VERSICOLOR
B361,B36.1 TINHA NEGRA
B362,B36.2 PIEDRA BRANCA
B363,B36.3 PIEDRA NEGRA
B368,B36.8 OUTR MICOSES SUPERF ESPEC
B369,B36.9 MICOSE SUPERF NE
B37,B37   CANDIDIASE
B370,B37.0 ESTOMATITE P/CANDIDA
B371,B37.1 CANDIDIASE PULMONAR
B372,B37.2 CANDIDIASE DA PELE E DAS UNHAS
B373,B37.3 CANDIDIASE DA VULVA E DA VAGINA
B374,B37.4 CANDIDIASE DE OUTR LOCALIZ UROGENITAIS
B375,B37.5 MENINGITE P/CANDIDA
B376,B37.6 ENDOCARDITE P/CANDIDA
B377,B37.7 SEPTICEMIA P/CANDIDA
B378,B37.8 CANDIDIASE DE OUTR LOCALIZ
B379,B37.9 CANDIDIASE NE
B38,B38   COCCIDIOIDOMICOSE
B380,B38.0 COCCIDIOIDOMICOSE PULMONAR AGUDA
B381,B38.1 COCCIDIOIDOMICOSE PULMONAR CRONICA
B382,B38.2 COCCIDIOIDOMICOSE PULMONAR NE
B383,B38.3 COCCIDIOIDOMICOSE CUTANEA
B384,B38.4 MENINGITE P/COCCIDIOIDOMICOSE
B387,B38.7 COCCIDIOIDOMICOSE DISSEMINADA
B388,B38.8 OUTR FORM DE COCCIDIOIDOMICOSE
B389,B38.9 COCCIDIOIDOMICOSE NE
B39,B39   HISTOPLASMOSE
B390,B39.0 HISTOPLASMOSE PULMONAR AGUDA P/H.CAPSULATUM
B391,B39.1 HISTOPLASMOSE PULMONAR CRONIC P/H.CAPSULATUM
B392,B39.2 HISTOPLASMOSE PULMONAR NE P/H.CAPSULATUM
B393,B39.3 HISTOPLASMOSE DISSEMINADA P/H.CAPSULATUM
B394,B39.4 HISTOPLASMOSE NE P/HISTOPLASMA CAPSULATUM
B395,B39.5 HISTOPLASMOSE P/HISTOPLASMA DUBOISII
B399,B39.9 HISTOPLASMOSE NE
B40,B40   BLASTOMICOSE
B400,B40.0 BLASTOMICOSE PULMONAR AGUDA
B401,B40.1 BLASTOMICOSE PULMONAR CRONICA
B402,B40.2 BLASTOMICOSE PULMONAR NE
B403,B40.3 BLASTOMICOSE CUTANEA
B407,B40.7 BLASTOMICOSE DISSEMINADA
B408,B40.8 OUTR FORM DE BLASTOMICOSE
B409,B40.9 BLASTOMICOSE NE
B41,B41   PARACOCCIDIOIDOMICOSE
B410,B41.0 PARACOCCIDIOIDOMICOSE PULMONAR
B417,B41.7 PARACOCCIDIOIDOMICOSE DISSEMINADA
B418,B41.8 OUTR FORM DE PARACOCCIDIOIDOMICOSE
B419,B41.9 PARACOCCIDIOIDOMICOSE NE
B42,B42   ESPOROTRICOSE
B420,B42.0 ESPOROTRICOSE PULMONAR
B421,B42.1 ESPOROTRICOSE LINFOCUTANEA
B427,B42.7 ESPOROTRICOSE DISSEMINADA
B428,B42.8 OUTR FORM DE ESPOROTRICOSE
B429,B42.9 ESPOROTRICOSE NE
B43,B43   CROMOMICOSE E ABSCESSO FEOMICOTICO
B430,B43.0 CROMOMICOSE CUTANEA
B431,B43.1 ABSCESSO CEREBRAL FEOMICOTICO
B432,B43.2 ABSCESSO E CISTO FEOMICOTICO SUBCUTANEOS
B438,B43.8 OUTR FORM DE CROMOMICOSE
B439,B43.9 CROMOMICOSE NE
B44,B44   ASPERGILOSE
B440,B44.0 ASPERGILOSE PULMONAR INVASIVA
B441,B44.1 OUTR ASPERGILOSES PULMONARES
B442,B44.2 ASPERGILOSE AMIGDALIANA
B447,B44.7 ASPERGILOSE DISSEMINADA
B448,B44.8 OUTR FORM DE ASPERGILOSE
B449,B44.9 ASPERGILOSE NE
B45,B45   CRIPTOCOCOSE
B450,B45.0 CRIPTOCOCOSE PULMONAR
B451,B45.1 CRIPTOCOCOSE CEREBRAL
B452,B45.2 CRIPTOCOCOSE CUTANEA
B453,B45.3 CRIPTOCOCOSE OSSEA
B457,B45.7 CRIPTOCOCOSE DISSEMINADA
B458,B45.8 OUTR FORM DE CRIPTOCOCOSE
B459,B45.9 CRIPTOCOCOSE NE
B46,B46   ZIGOMICOSE
B460,B46.0 MUCORMICOSE PULMONAR
