"cid_cod","cid_descr"
I69,I69   SEQUELAS DE DOENC CEREBROVASCULARES
I690,I69.0 SEQUELAS DE HEMORRAGIA SUBARANOIDEA
I691,I69.1 SEQUELAS DE HEMORRAGIA INTRACEREBRAL
I692,I69.2 SEQUELAS OUTR HEMORRAG INTRACRAN NAO TRAUM
I693,I69.3 SEQUELAS DE INFARTO CEREBRAL
I694,I69.4 SEQUELAS ACID VASC CEREBR NE C/HEMORR ISQUEM
I698,I69.8 SEQUELAS OUTR DOENC CEREBROVASCULARES E NE
I70,I70   ATEROSCLEROSE
I700,I70.0 ATEROSCLEROSE DA AORTA
I701,I70.1 ATEROSCLEROSE DA ARTERIA RENAL
I702,I70.2 ATEROSCLEROSE DAS ARTERIAS DAS EXTREMIDADES
I708,I70.8 ATEROSCLEROSE DE OUTR ARTERIAS
I709,I70.9 ATEROSCLEROSE GENERALIZADA E A NE
I71,I71   ANEURISMA E DISSECCAO DA AORTA
I710,I71.0 ANEURISMA DISSECANTE DA AORTA
I711,I71.1 ANEURISMA DA AORTA TORACICA ROTO
I712,I71.2 ANEURISMA DA AORTA TORACICA S/MENCAO RUPTURA
I713,I71.3 ANEURISMA DA AORTA ABDOMINAL ROTO
I714,I71.4 ANEURISMA AORTA ABDOMINAL S/MENCAO RUPTURA
I715,I71.5 ANEURISMA DA AORTA TORACO-ABDOMINAL ROTO
I716,I71.6 ANEURISMA AORTA TORACO-ABDOM S/MENC RUPTURA
I718,I71.8 ANEURISMA DA AORTA DE LOCALIZ NE ROTO
I719,I71.9 ANEURISMA AORTICO LOCAL NE S/MENCAO RUPTURA
I72,I72   OUTR ANEURISMAS
I720,I72.0 ANEURISMA DA ARTERIA CAROTIDA
I721,I72.1 ANEURISMA DE ARTERIA DOS MEMBROS SUPER
I722,I72.2 ANEURISMA DA ARTERIA RENAL
I723,I72.3 ANEURISMA DE ARTERIA ILIACA
I724,I72.4 ANEURISMA DE ARTERIA DOS MEMBROS INFER
I728,I72.8 ANEURISMA DE OUTR ARTERIAS ESPEC
I729,I72.9 ANEURISMA DE LOCALIZ NE
I73,I73   OUTR DOENC VASCULARES PERIFERICAS
I730,I73.0 SINDR DE RAYNAUD
I731,I73.1 TROMBOANGEITE OBLITERANTE
I738,I73.8 OUTR DOENC VASCULARES PERIFERICAS ESPEC
I739,I73.9 DOENC VASCULARES PERIFERICAS NE
I74,I74   EMBOLIA E TROMBOSE ARTERIAIS
I740,I74.0 EMBOLIA E TROMBOSE DA AORTA ABDOMINAL
I741,I74.1 EMBOLIA TROMBOSE OUTR PORCOES DA AORTA E NE
I742,I74.2 EMBOLIA E TROMBOSE DE ARTERIAS MEMBROS SUPER
I743,I74.3 EMBOLIA E TROMBOSE DE ARTERIAS MEMBROS INFER
I744,I74.4 EMBOLIA E TROMBOSE DE ARTERIAS MEMBROS NE
I745,I74.5 EMBOLIA E TROMBOSE DA ARTERIA ILIACA
I748,I74.8 EMBOLIA E TROMBOSE DE OUTR ARTERIAS
I749,I74.9 EMBOLIA E TROMBOSE DE ARTERIA NE
I77,I77   OUTR AFECCOES DAS ARTERIAS E ARTERIOLAS
I770,I77.0 FISTULA ARTERIOVENOSA ADQUIR
I771,I77.1 ESTENOSE DE ARTERIA
I772,I77.2 RUPTURA DE ARTERIA
I773,I77.3 DISPLASIA FIBROMUSCULAR ARTERIAL
I774,I77.4 SINDR DE COMPRESSAO DA ARTERIA CELIACA
I775,I77.5 NECROSE DE ARTERIA
I776,I77.6 ARTERITE NE
I778,I77.8 OUTR AFECCOES ESPEC ARTERIAS E ARTERIOLAS
I779,I77.9 AFECCOES DE ARTERIAS E ARTERIOLAS NE
I78,I78   DOENC DOS CAPILARES
I780,I78.0 TELANGIECTASIA HEMORRAGICA HEREDITARIA
I781,I78.1 NEVO NAO-NEOPLASICO
I788,I78.8 OUTR DOENC DOS CAPILARES
I789,I78.9 DOENC NE DOS CAPILARES
I79,I79   TRANST ARTER ARTERIOLAS CAPILARES DOENC COP
I790,I79.0 ANEURISMA DA AORTA EM DOENC COP
I791,I79.1 AORTITE EM DOENC COP
I792,I79.2 ANGIOPATIA PERIFERICA EM DOENC COP
I798,I79.8 OUTR TRANST ARTER ARTERIOLAS CAPIL DOENC COP
I80,I80   FLEBITE E TROMBOFLEBITE
I800,I80.0 FLEBITE TROMBOFLEBITE VASOS SUPERF MEMBR INF
I801,I80.1 FLEBITE E TROMBOFLEBITE DA VEIA FEMURAL
I802,I80.2 FLEBITE TROMBOFLEB OUTR VASOS PROF MEMBR INF
I803,I80.3 FLEBITE E TROMBOFLEBITE DOS MEMBROS INFER NE
I808,I80.8 FLEBITE E TROMBOFLEBITE DE OUTR LOCALIZ
I809,I80.9 FLEBITE E TROMBOFLEBITE DE LOCALIZ NE
I81,I81   TROMBOSE DA VEIA PORTA
I82,I82   OUTR EMBOLIA E TROMBOSE VENOSAS
I820,I82.0 SINDR DE BUDD-CHIARI
I821,I82.1 TROMBOFLEBITE MIGRATORIA
I822,I82.2 EMBOLIA E TROMBOSE DE VEIA CAVA
I823,I82.3 EMBOLIA E TROMBOSE DE VEIA RENAL
I828,I82.8 EMBOLIA E TROMBOSE DE OUTR VEIAS ESPEC
I829,I82.9 EMBOLIA E TROMBOSE VENOSAS DE VEIA NE
I83,I83   VARIZES DOS MEMBROS INFER
I830,I83.0 VARIZES DOS MEMBROS INFER C/ULCERA
I831,I83.1 VARIZES DOS MEMBROS INFER C/INFLAM
I832,I83.2 VARIZES MEMBROS INFER C/ULCERA E INFLAM
I839,I83.9 VARIZES MEMBROS INFER S/ULCERA OU INFLAM
I84,I84   HEMORROIDAS
I840,I84.0 HEMORROIDAS INTERNAS TROMBOSADAS
I841,I84.1 HEMORROIDAS INTERNAS C/OUTR COMPLIC
I842,I84.2 HEMORROIDAS INTERNAS S/COMPLIC
I843,I84.3 HEMORROIDAS EXTERNAS TROMBOSADAS
I844,I84.4 HEMORROIDAS EXTERNAS C/OUTR COMPLIC
I845,I84.5 HEMORROIDAS EXTERNAS S/COMPLIC
I846,I84.6 PLICOMAS HEMORROIDARIOS RESIDUAIS
I847,I84.7 HEMORROIDAS TROMBOSADAS NE
I848,I84.8 HEMORROIDAS NE C/OUTR COMPLIC
I849,I84.9 HEMORROIDAS S/COMPLIC NE
I85,I85   VARIZES ESOFAGIANAS
I850,I85.0 VARIZES ESOFAGIANAS SANGRANTES
I859,I85.9 VARIZES ESOFAGIANAS S/SANGRAMENTO
I86,I86   VARIZES DE OUTR LOCALIZ
I860,I86.0 VARIZES SUBLINGUAIS
I861,I86.1 VARIZES ESCROTAIS
I862,I86.2 VARIZES PELVICAS
I863,I86.3 VARIZES DA VULVA
I864,I86.4 VARIZES GASTRICAS
I868,I86.8 VARIZES DE OUTR LOCALIZ ESPEC
I87,I87   OUTR TRANST DAS VEIAS
I870,I87.0 SINDR POS-FLEBITE
I871,I87.1 COMPRESSAO VENOSA
I872,I87.2 INSUF VENOSA
I878,I87.8 OUTR TRANST VENOSOS ESPEC
I879,I87.9 TRANST VENOSO NE
I88,I88   LINFADENITE INESPECIFICA
I880,I88.0 LINFADENITE MESENTERICA NAO ESPECIFICA
I881,I88.1 LINFADENITE CRONICA EXCETO A MESENTERICA
I888,I88.8 OUTR LINFADENITES INESPECIFICAS
I889,I88.9 LINFADENITE NE
I89,I89   OUTR TRANST NAO-INFECC VASOS LINF GANGL LINF
I890,I89.0 LINFEDEMA NCOP
I891,I89.1 LINFANGITE
I898,I89.8 OUT TRANST N-INF ESPEC VASOS LINF GANGL LINF
I899,I89.9 TRANST NAO-INFECC VASOS LINF GANGL LINF NE
I95,I95   HIPOTENSAO
I950,I95.0 HIPOTENSAO IDIOPATICA
I951,I95.1 HIPOTENSAO ORTOSTATICA
I952,I95.2 HIPOTENSAO DEV DROGAS
I958,I95.8 OUTR TIPOS DE HIPOTENSAO
I959,I95.9 HIPOTENSAO NE
I97,I97   TRANST APARELHO CIRCULAT SUBSEQ PROCED NCOP
I970,I97.0 SINDR POS-CARDIOTOMIA
I971,I97.1 OUTR DISTURB FUNC SUBSEQ CIRURGIA CARDIACA
I972,I97.2 SINDR DO LINFEDEMA POS-MASTECTOMIA
I978,I97.8 OUTR TRANST AP CIRCULAT SUBSEQ PROCED NCOP
I979,I97.9 TRANST APARELHO CIRCULAT SUBSEQ PROCED NE
I98,I98   OUTR TRANST APARELHO CIRCULATORIO DOENC COP
I980,I98.0 SIFILIS CARDIOVASCULAR
I981,I98.1 TRANST CARDIOVASC OUTR DOENC INF PARASIT COP
I982,I98.2 VARIZES ESOFAGIANAS EM DOENC COP
I988,I98.8 OUTR TRANST ESPEC AP CIRCULAT DOENC COP
I99,I99   OUTR TRANST DO APARELHO CIRCULATORIO E OS NE
J00,J00   NASOFARINGITE AGUDA
J01,J01   SINUSITE AGUDA
J010,J01.0 SINUSITE MAXILAR AGUDA
J011,J01.1 SINUSITE FRONTAL AGUDA
J012,J01.2 SINUSITE ETMOIDAL AGUDA
J013,J01.3 SINUSITE ESFENOIDAL AGUDA
J014,J01.4 PANSINUSITE AGUDA
J018,J01.8 OUTR SINUSITES AGUDAS
J019,J01.9 SINUSITE AGUDA NE
J02,J02   FARINGITE AGUDA
J020,J02.0 FARINGITE ESTREPTOCOCICA
J028,J02.8 FARINGITE AGUDA DEV OUTR MICROORG ESPEC
J029,J02.9 FARINGITE AGUDA NE
J03,J03   AMIGDALITE AGUDA
J030,J03.0 AMIGDALITE ESTREPTOCOCICA
J038,J03.8 AMIGDALITE AGUDA DEV OUTR MICROORG ESPEC
J039,J03.9 AMIGDALITE AGUDA NE
J04,J04   LARINGITE E TRAQUEITE AGUDAS
J040,J04.0 LARINGITE AGUDA
J041,J04.1 TRAQUEITE AGUDA
J042,J04.2 LARINGOTRAQUEITE AGUDA
J05,J05   LARINGITE OBSTRUTIVA AGUDA E EPIGLOTITE
J050,J05.0 LARINGITE OBSTRUTIVA AGUDA
J051,J05.1 EPIGLOTITE AGUDA
J06,J06   INFECC AGUDAS VIAS AEREAS SUPER LOC MULT NE
J060,J06.0 LARINGOFARINGITE AGUDA
J068,J06.8 OUTR INFECC AGUDAS VIAS AEREAS SUP LOC MULT
J069,J06.9 INFECC AGUDA DAS VIAS AEREAS SUPER NE
J10,J10   INFLUENZA DEV VIRUS INFLUENZA IDENTIFICADO
J100,J10.0 INFLUENZA C/PNEUM DEV VIRUS INFLUENZA IDENT
J101,J10.1 INFLUENZ C/OUT MANIF RESP DEV VIR INFL IDENT
J108,J10.8 INFLUENZA C/OUTR MANIF DEV VIRUS INFL IDENT
J11,J11   INFLUENZA DEV VIRUS NAO IDENTIFICADO
J110,J11.0 INFLUENZA C/PNEUMONIA DEV VIRUS NAO IDENT
J111,J11.1 INFLUENZA C/OUT MANIF RESP DEV VIRUS N IDENT
J118,J11.8 INFLUENZA C/OUTR MANIF DEV VIRUS NAO IDENT
J12,J12   PNEUMONIA VIRAL NCOP
J120,J12.0 PNEUMONIA DEV ADENOVIRUS
J121,J12.1 PNEUMONIA DEV VIRUS RESPIRAT SINCICIAL
J122,J12.2 PNEUMONIA DEV PARAINFLUENZA
J128,J12.8 OUTR PNEUMONIAS VIRAIS
J129,J12.9 PNEUMONIA VIRAL NE
J13,J13   PNEUMONIA DEV STREPTOCOCCUS PNEUMONIAE
J14,J14   PNEUMONIA DEV HAEMOPHILUS INFUENZAE
J15,J15   PNEUMONIA BACTER NCOP
J150,J15.0 PNEUMONIA DEV KLEBSIELLA PNEUMONIAE
J151,J15.1 PNEUMONIA DEV PSEUDOMONAS
J152,J15.2 PNEUMONIA DEV STAPHYLOCOCCUS
J153,J15.3 PNEUMONIA DEV STREPTOCOCCUS DO GRUPO B
J154,J15.4 PNEUMONIA DEV OUTR ESTREPTOCOCOS
J155,J15.5 PNEUMONIA DEV ESCHERICHIA COLI
J156,J15.6 PNEUMONIA DEV OUTR BACT AEROBICAS GRAM-NEG
J157,J15.7 PNEUMONIA DEV MYCOPLASMA PNEUMONIAE
J158,J15.8 OUTR PNEUMONIAS BACTER
J159,J15.9 PNEUMONIA BACTER NE
J16,J16   PNEUMONIA DEV OUT MICROORG INFECC ESPEC NCOP
J160,J16.0 PNEUMONIA DEV CLAMIDIAS
J168,J16.8 PNEUMONIA DEV OUTR MICROORG INFECC ESPEC
J17,J17   PNEUMONIA EM DOENC COP
J170,J17.0 PNEUMONIA EM DOENC BACTER COP
J171,J17.1 PNEUMONIA EM DOENC VIRAIS COP
J172,J17.2 PNEUMONIA EM MICOSES COP
J173,J17.3 PNEUMONIA EM DOENC PARASIT COP
J178,J17.8 PNEUMONIA EM OUTR DOENC COP
J18,J18   PNEUMONIA P/MICROORG NE
J180,J18.0 BRONCOPNEUMONIA NE
J181,J18.1 PNEUMONIA LOBAR NE
J182,J18.2 PNEUMONIA HIPOSTATICA NE
J188,J18.8 OUTR PNEUMONIAS DEV MICROORG NE
J189,J18.9 PNEUMONIA NE
J20,J20   BRONQUITE AGUDA
J200,J20.0 BRONQUITE AGUDA DEV MYCOPLASMA PNEUMONIAE
J201,J20.1 BRONQUITE AGUDA DEV HAEMOPHILUS INFLUENZAE
J202,J20.2 BRONQUITE AGUDA DEV ESTREPTOCOCOS
J203,J20.3 BRONQUITE AGUDA DEV VIRUS COXSACKIE
J204,J20.4 BRONQUITE AGUDA DEV VIRUS PARAINFLUENZA
J205,J20.5 BRONQUITE AGUDA DEV VIRUS SINCICIAL RESPIRAT
J206,J20.6 BRONQUITE AGUDA DEV RINOVIRUS
J207,J20.7 BRONQUITE AGUDA DEV ECHOVIRUS
J208,J20.8 BRONQUITE AGUDA DEV OUTR MICROORG ESPEC
J209,J20.9 BRONQUITE AGUDA NE
J21,J21   BRONQUIOLITE AGUDA
J210,J21.0 BRONQUIOLITE AGUDA DEV VIRUS SINCICIAL RESP
J218,J21.8 BRONQUIOLITE AGUDA DEV OUTR MICROORG ESPEC
J219,J21.9 BRONQUITE AGUDA NE
J22,J22   INFECC AGUDAS NE DAS VIAS AEREAS INFER
J30,J30   RINITE ALERGICA E VASOMOTORA
J300,J30.0 RINITE VASOMOTORA
J301,J30.1 RINITE ALERGICA DEV POLEN
J302,J30.2 OUTR RINITES ALERGICAS SAZONAIS
J303,J30.3 OUTR RINITES ALERGICAS
J304,J30.4 RINITE ALERGICA NE
J31,J31   RINITE NASOFARINGITE E FARINGITE CRONICAS
J310,J31.0 RINITE CRONICA
J311,J31.1 NASOFARINGITE CRONICA
J312,J31.2 FARINGITE CRONICA
J32,J32   SINUSITE CRONICA
J320,J32.0 SINUSITE MAXILAR CRONICA
J321,J32.1 SINUSITE FRONTAL CRONICA
J322,J32.2 SINUSITE ETMOIDAL CRONICA
J323,J32.3 SINUSITE ESFENOIDAL CRONICA
J324,J32.4 PANSINUSITE CRONICA
J328,J32.8 OUTR SINUSITES CRONICAS
J329,J32.9 SINUSITE CRONICA NE
J33,J33   POLIPO NASAL
J330,J33.0 POLIPO DA CAVIDADE NASAL
J331,J33.1 DEGENERACAO POLIPOIDE DO SEIO PARANASAL
J338,J33.8 OUTR POLIPOS DO SEIO PARANASAL
J339,J33.9 POLIPO NASAL NE
J34,J34   OUTR TRANST DO NARIZ E DOS SEIOS PARANASAIS
J340,J34.0 ABSCESSO FURUNCULO E CARBUNCULO DO NARIZ
J341,J34.1 CISTO E MUCOCELE DE SEIO PARANASAL
J342,J34.2 DESVIO DO SEPTO NASAL
J343,J34.3 HIPERTROFIA DOS CORNETOS NASAIS
J348,J34.8 OUTR TRANST ESPEC NARIZ E SEIOS PARANASAIS
J35,J35   DOENC CRONICAS DAS AMIGDALAS E DAS ADENOIDES
J350,J35.0 AMIGDALITE CRONICA
J351,J35.1 HIPERTROFIA DAS AMIGDALAS
J352,J35.2 HIPERTROFIA DAS ADENOIDES
J353,J35.3 HIPERTROFIA AMIGDALAS C/HIPERTROF ADENOIDES
J358,J35.8 OUTR DOENC CRONICAS AMIGDALAS E ADENOIDES
J359,J35.9 DOENC DAS AMIGDALAS E DAS ADENOIDES NE
J36,J36   ABSCESSO PERIAMIGDALIANO
J37,J37   LARINGITE E LARINGOTRAQUEITE CRONICAS
J370,J37.0 LARINGITE CRONICA
J371,J37.1 LARINGOTRAQUEITE CRONICA
J38,J38   DOENC DAS CORDAS VOCAIS E DA LARINGE NCOP
J380,J38.0 PARALISIA DAS CORDAS VOCAIS E DA LARINGE
J381,J38.1 POLIPO DAS CORDAS VOCAIS E DA LARINGE
J382,J38.2 NODULOS DAS CORDAS VOCAIS
J383,J38.3 OUTR DOENC DAS CORDAS VOCAIS
J384,J38.4 EDEMA DA LARINGE
J385,J38.5 ESPASMO DA LARINGE
J386,J38.6 ESTENOSE DA LARINGE
J387,J38.7 OUTR DOENC DA LARINGE
J39,J39   OUTR DOENC DAS VIAS AEREAS SUPER
J390,J39.0 ABSCESSO RETROFARINGEO E PARAFARINGEO
J391,J39.1 OUTR ABSCESSOS DA FARINGE
J392,J39.2 OUTR DOENC DA FARINGE
J393,J39.3 REACAO HIPERSENSIB VIAS AEREAS SUPER LOC NE
J398,J39.8 OUTR DOENC ESPEC DAS VIAS AEREAS SUPER
J399,J39.9 DOENC NE DAS VIAS AEREAS SUPER
J40,J40   BRONQUITE NE COMO AGUDA OU CRONICA
J41,J41   BRONQUITE CRONICA SIMPLES E A MUCOPURULENTA
J410,J41.0 BRONQUITE CRONICA SIMPLES
J411,J41.1 BRONQUITE CRONICA MUCOPURULENTA
J418,J41.8 BRONQUITE CRON MISTA SIMPLES E MUCOPURULENTA
J42,J42   BRONQUITE CRONICA NE
J43,J43   ENFISEMA
J430,J43.0 SINDR DE MACLEOD
J431,J43.1 ENFISEMA PANLOBULAR
J432,J43.2 ENFISEMA CENTROLOBULAR
J438,J43.8 OUTR FORM DE ENFISEMA
J439,J43.9 ENFISEMA NE
J44,J44   OUTR DOENC PULMONARES OBSTRUTIVAS CRONICAS
J440,J44.0 DOEN PULM OBS CRON C/INF RESP AG TR RESP INF
J441,J44.1 DOENC PULMONAR OBSTR CRON C/EXACERB AGUDA NE
J448,J44.8 OUTR FORM ESPEC DOENC PULMONAR OBSTRUT CRON
J449,J44.9 DOENC PULMONAR OBSTRUTIVA CRONICA NE
J45,J45   ASMA
J450,J45.0 ASMA PREDOM ALERGICA
J451,J45.1 ASMA NAO-ALERGICA
J458,J45.8 ASMA MISTA
J459,J45.9 ASMA NE
J46,J46   ESTADO DE MAL ASMATICO
J47,J47   BRONQUECTASIA
J60,J60   PNEUMOCONIOSE DOS MINEIROS DE CARVAO
J61,J61   PNEUMOCONIOSE DEV AMIANTO OUTR FIBR MINERAIS
J62,J62   PNEUMOCONIOSE DEV POEIRA QUE CONT SILICA
J620,J62.0 PNEUMOCONIOSE DEV PO DE TALCO
J628,J62.8 PNEUMOCONIOSE DEV OUTR POEIRAS Q CONT SILICA
J63,J63   PNEUMOCONIOSE DEV OUTR POEIRAS INORGANICAS
J630,J63.0 ALUMINOSE
J631,J63.1 FIBROSE CAUSADA P/BAUXITA
J632,J63.2 BERILIOSE
J633,J63.3 FIBROSE CAUSADA P/GRAFITE
J634,J63.4 SIDEROSE
J635,J63.5 ESTANOSE
J638,J63.8 PNEUMOCONIOSE DEV OUTR POEIRA INORG ESPEC
J64,J64   PNEUMOCONIOSE NE
J65,J65   PNEUMOCONIOSE ASSOC C/TUBERC
J66,J66   DOENC DAS VIAS AEREAS DEV POEIRAS ORG ESPEC
J660,J66.0 BISSINOSE
J661,J66.1 DOENC DOS CARDADORES DE LINHO
J662,J66.2 CANABINOSE
J668,J66.8 DOENC VIAS AEREAS DEV OUTR POEIRAS ORG ESPEC
J67,J67   PNEUMONITE HIPERSENSIBILID DEV POEIRAS ORG
J670,J67.0 PULMAO DE FAZENDEIRO
J671,J67.1 BAGACOSE
J672,J67.2 PULMAO DOS CRIADORES DE PASSAROS
J673,J67.3 SUBEROSE
J674,J67.4 PULMAO DOS TRABALHADORES DO MALTE
J675,J67.5 PULMAO DOS QUE TRABALHAM C/COGUMELOS
J676,J67.6 PULMAO DOS CORTADORES DE CASCA DO BORDO
J677,J67.7 DOENC PULMONAR DEV SIST AR COND UMIDIF AR
J678,J67.8 PNEUMONITES HIPERSENS DEV OUTR POEIRAS ORG
J679,J67.9 PNEUMONITE HIPERSENSIBILID DEV POEIRA ORG NE
J68,J68   AFECC RESP DEV INAL PROD QUIM GAS FUMAC VAP
J680,J68.0 BRONQUIT PNEUMON DEV PROD QUIM GAS FUMAC VAP
J681,J68.1 EDEMA PULM AGUDO DEV PROD QUIM GAS FUMAC VAP
J682,J68.2 INFL VIA AER SUP DEV PR QUI GAS FUM VAP NCOP
J683,J68.3 OUT AF RESP AG SUBAG DEV PRO QUI GAS FUM VAP
J684,J68.4 AFECC RESP CRON DEV PROD QUIM GAS FUM VAP
J688,J68.8 OUTR AFECC RESP DEV PROD QUIM GAS FUM VAP
J689,J68.9 AFECC RESP NE DEV PROD QUIM GASES FUMAC VAP
J69,J69   PNEUMONITE DEV SOLIDOS E LIQUIDOS
J690,J69.0 PNEUMONITE DEV ALIMENTO OU VOMITO
J691,J69.1 PNEUMONITE DEV OLEOS E ESSENCIAS
J698,J69.8 PNEUMONITE DEV OUTR SOLIDOS E LIQUIDOS
J70,J70   AFECCOES RESPIRAT DEV OUTR AGENTES EXTERNOS
J700,J70.0 MANIFESTACOES PULMONARES AGUDAS DEV RADIACAO
J701,J70.1 MANIF PULMONARES CRON E OUTR DEV RADIACAO
J702,J70.2 TRANST PULM INTERSTIC AGUDOS INDUZ P/DROGA
J703,J70.3 TRANST PULM INTERSTIC CRONICOS INDUZ P/DROGA
J704,J70.4 TRANST PULM INTERSTICIAL NE INDUZ P/DROGA
J708,J70.8 AFECC RESPIRAT DEV OUTR AGENT EXTERNOS ESPEC
J709,J70.9 AFECCOES RESPIRAT DEV AGENTES EXTERNOS NE
J80,J80   SINDR DO DESCONFORTO RESPIRAT DO ADULTO
J81,J81   EDEMA PULMONAR NE DE OUTR FORM
J82,J82   EOSINOFILIA PULMONAR NCOP
J84,J84   OUTR DOENC PULMONARES INTERSTICIAIS
J840,J84.0 AFECCOES ALVEOLARES E PARIETO-ALVEOLARES
J841,J84.1 OUTR DOENC PULM INTERSTICIAIS C/FIBROSE
J848,J84.8 OUTR DOENC PULMONARES INTERSTICIAIS ESPEC
J849,J84.9 DOENC PULMONAR INTERSTICIAL NE
J85,J85   ABSCESSO DO PULMAO E DO MEDIASTINO
J850,J85.0 GANGRENA E NECROSE DO PULMAO
J851,J85.1 ABSCESSO DO PULMAO C/PNEUMONIA
J852,J85.2 ABSCESSO DO PULMAO S/PNEUMONIA
J853,J85.3 ABSCESSO DO MEDIASTINO
J86,J86   PIOTORAX
J860,J86.0 PIOTORAX C/FISTULA
J869,J86.9 PIOTORAX S/FISTULA
J90,J90   DERRAME PLEURAL NCOP
J91,J91   DERRAME PLEURAL EM AFECCOES COP
J92,J92   PLACAS PLEURAIS
J920,J92.0 PLACAS PLEURAIS C/PRESENCA DE AMIANTO
J929,J92.9 PLACAS PLEURAIS CEM PRESENCA DE AMIANTO
J93,J93   PNEUMOTORAX
J930,J93.0 PNEUMOTORAX DE TENSAO ESPONTANEO
J931,J93.1 OUTR FORM DE PNEUMOTORAX ESPONTANEO
J938,J93.8 OUTR TIPOS DE PNEUMOTORAX ESPEC
J939,J93.9 PNEUMOTORAX NE
J94,J94   OUTR AFECCOES PLEURAIS
J940,J94.0 DERRAME QUILOSO OU QUILIFORME
J941,J94.1 FIBROTORAX
J942,J94.2 HEMOTORAX
J948,J94.8 OUTR AFECCOES PLEURAIS ESPEC
J949,J94.9 AFECCAO PLEURAL NE
J95,J95   AFECCOES RESPIRAT POS-PROCED NCOP
J950,J95.0 MAU FUNCIONAMENTO DE TRAQUEOSTOMIA
J951,J95.1 INSUF PULMONAR AGUDA SUBSEQ CIRURG TORACICA
J952,J95.2 INSUF PULM AGUDA SUBSEQ CIRURG NAO TORACICA
J953,J95.3 INSUF PULMONAR CRONICA POS-CIRURGICA
J954,J95.4 SINDR DE MENDELSON
J955,J95.5 ESTENOSE SUBGLOTICA POS-PROCED
J958,J95.8 OUTR TRANST RESPIRAT POS-PROCED
J959,J95.9 TRANST RESPIRAT POS-PROCED NE
J96,J96   INSUF RESPIRAT NCOP
J960,J96.0 INSUF RESPIRAT AGUDA
J961,J96.1 INSUF RESPIRAT CRONICA
J969,J96.9 INSUF RESPIRAT NE
J98,J98   OUTR TRANST RESPIRAT
J980,J98.0 OUTR DOENC DOS BRONQUIOS NCOP
J981,J98.1 COLAPSO PULMONAR
J982,J98.2 ENFISEMA INTERSTICIAL
J983,J98.3 ENFISEMA COMPENSATORIO
J984,J98.4 OUTR TRANST PULMONARES
J985,J98.5 DOENC DO MEDIASTINO NCOP
J986,J98.6 TRANST DO DIAFRAGMA
J988,J98.8 OUTR TRANST RESPIRAT ESPEC
J989,J98.9 TRANST RESPIRAT NE
J99,J99   TRANST RESPIRAT EM DOENC COP
J990,J99.0 DOENC PULMONAR REUMATOIDE
J991,J99.1 TRANST RESPIRAT OUTR DOENC SIST TEC CONJ COP
J998,J99.8 TRANST RESPIRAT EM OUTR DOENC COP
K00,K00   DISTURBIOS DESENVOLV E DA ERUPCAO DOS DENTES
K000,K00.0 ANODONTIA
K001,K00.1 DENTES SUPRANUMERARIOS
K002,K00.2 ANOMALIAS DO TAMANHO E DA FORM DOS DENTES
K003,K00.3 DENTES MANCHADOS
K004,K00.4 DISTURBIOS NA FORMACAO DOS DENTES
K005,K00.5 ANOMALIAS HEREDITARIAS ESTRUT DENTARIA NCOP
K006,K00.6 DISTURBIOS DA ERUPCAO DENTARIA
K007,K00.7 SINDR DA ERUPCAO DENTARIA
K008,K00.8 OUTR DISTURBIOS DO DESENVOLV DOS DENTES
K009,K00.9 DISTURBIO NE DO DESENVOLV DENTARIO
K01,K01   DENTES INCLUSOS E IMPACTADOS
K010,K01.0 DENTES INCLUSOS
K011,K01.1 DENTES IMPACTADOS
K02,K02   CARIE DENTARIA
K020,K02.0 CARIES LIMITADAS AO ESMALTE
K021,K02.1 CARIES DA DENTINA
K022,K02.2 CARIE DO CEMENTO
K023,K02.3 CARIES DENTARIAS ESTAVEIS
K024,K02.4 ODONTOCLASIA
K028,K02.8 OUTR CARIES DENTARIAS
K029,K02.9 CARIE DENTARIA SOE
K03,K03   OUTR DOENC DOS TEC DENTARIOS DUROS
K030,K03.0 ATRITO DENTARIO EXCESSIVO
K031,K03.1 ABRASAO DENTARIA
K032,K03.2 EROSAO DENTARIA
K033,K03.3 REABSORCAO PATOLOGICA DOS DENTES
K034,K03.4 HIPERCEMENTOSE
K035,K03.5 ANCILOSE DENTARIA
K036,K03.6 DEPOSITOS NOS DENTES
K037,K03.7 ALTERAC POS-ERUPTIVAS COR TEC DUROS DENTES
K038,K03.8 OUTR DOENC ESPEC DOS TEC DUROS DOS DENTES
K039,K03.9 DOENC DOS TEC DUROS DOS DENTES NE
K04,K04   DOENC DA POLPA E DOS TEC PERIAPICAIS
K040,K04.0 PULPITE
K041,K04.1 NECROSE DA POLPA
K042,K04.2 DEGENERACAO DA POLPA
K043,K04.3 FORMACAO ANORMAL DE TEC DUROS NA POLPA
K044,K04.4 PERIODONTITE APICAL AGUDA ORIG PULPAR
K045,K04.5 PERIODONTITE APICAL CRONICA
K046,K04.6 ABSCESSO PERIAPICAL C/FISTULA
K047,K04.7 ABSCESSO PERIAPICAL S/FISTULA
K048,K04.8 CISTO RADICULAR
K049,K04.9 OUTR DOENC DA POLPA E TEC PERIAPICAIS E NE
K05,K05   GENGIVITE E DOENC PERIODONTAIS
K050,K05.0 GENGIVITE AGUDA
K051,K05.1 GENGIVITE CRONICA
K052,K05.2 PERIODONTITE AGUDA
K053,K05.3 PERIODONTITE CRONICA
K054,K05.4 PERIODONTOSE
K055,K05.5 OUTR DOENC PERIODONTAIS
K056,K05.6 DOENC PERIODONTAL SOE
K06,K06   OUTR TRANST GENGIVA REBORDO ALVEOLAR S/DENT
K060,K06.0 RETRACAO GENGIVAL
K061,K06.1 HIPERPLASIA GENGIVAL
K062,K06.2 LESOES GENG REBORD ALVEOL S/DENT ASSOC TRAUM
K068,K06.8 OUTR TRANST ESPEC GENG REBORD ALVEOL S/DENT
K069,K06.9 TRANST GENGIVA REBORDO ALVEOLAR S/DENTES SOE
K07,K07   ANOMALIAS DENTOFACIAIS
K070,K07.0 ANOMALIAS IMPORTANTES TAMANHO DA MANDIBULA
K071,K07.1 ANOMALIAS RELACAO ENTRE MANDIBULA BASE CRAN
K072,K07.2 ANOMALIAS RELACAO ENTRE AS ARCADAS DENTARIAS
K073,K07.3 ANOMALIAS DA POSICAO DOS DENTES
K074,K07.4 MALOCLUSAO NE
K075,K07.5 ANORMALIDADES DENTOFACIAIS FUNCIONAIS
K076,K07.6 TRANST DA ARTICULACAO TEMPOROMANDIBULAR
K078,K07.8 OUTR ANOMALIAS DENTOFACIAIS
K079,K07.9 ANOMALIA DENTOFACIAL SOE
K08,K08   OUTR TRANST DENTES E ESTRUT DE SUSTENTACAO
K080,K08.0 EXFOLIACAO DOS DENTES DEV CAUSAS SISTEMICAS
K081,K08.1 PERDA DENT DEV ACID EXTR DOENC PERIODONT LOC
K082,K08.2 ATROFIA DO REBORDO ALVEOLAR S/DENTES
K083,K08.3 RAIZ DENTARIA RETIDA
K088,K08.8 OUTR TRANST ESPEC DENTES ESTRUT SUSTENTACAO
K089,K08.9 TRANST DENTES ESTRUTURAS SUSTENTACAO SOE
K09,K09   CISTOS DA REGIAO BUCAL NCOP
K090,K09.0 CISTOS ODONTOGENICOS DE DESENVOLV
K091,K09.1 CISTOS DE DESENVOLV DA REGIAO BUCAL
K092,K09.2 OUTR CISTOS DAS MANDIBULAS
K098,K09.8 OUTR CISTOS DA REGIAO ORAL NCOP
K099,K09.9 CISTOS DA REGIAO ORAL SOE
K10,K10   OUTR DOENC DOS MAXILARES
K100,K10.0 TRANST DO DESENVOLV DOS MAXILARES
K101,K10.1 GRANULOMA CENTRAL DE CELULAS GIGANTES
K102,K10.2 AFECCOES INFLAM DOS MAXILARES
K103,K10.3 ALVEOLITE MAXILAR
K108,K10.8 OUTR DOENC ESPEC DOS MAXILARES
K109,K10.9 DOENC DOS MAXILARES SOE
K11,K11   DOENC DAS GLAND SALIVARES
K110,K11.0 ATROFIA DE GLAND SALIVAR
K111,K11.1 HIPERTROFIA DE GLAND SALIVAR
K112,K11.2 SIALADENITE
K113,K11.3 ABSCESSO DE GLAND SALIVAR
K114,K11.4 FISTULA DE GLAND SALIVAR
K115,K11.5 SIALOLITIASE
K116,K11.6 MUCOCELE DE GLAND SALIVAR
K117,K11.7 ALTERACOES DA SECRECAO SALIVAR
K118,K11.8 OUTR DOENC DAS GLAND SALIVARES
K119,K11.9 DOENC DE GLAND SALIVAR SOE
K12,K12   ESTOMATITE E LESOES CORRELATAS
K120,K12.0 AFTAS BUCAIS RECIDIVANTES
K121,K12.1 OUTR FORM DE ESTOMATITE
K122,K12.2 CELULITE E ABSCESSO DA BOCA
K13,K13   OUTR DOENC DO LABIO E DA MUCOSA ORAL
K130,K13.0 DOENC DOS LABIOS
K131,K13.1 MORDEDURA DA MUCOSA DAS BOCHECHAS E LABIOS
K132,K13.2 LEUCOPLAS OUTR AFECC EPITELIO ORAL INCL LING
K133,K13.3 LEUCOPLASIA PILOSA
K134,K13.4 LESOES GRANULOMAT GRANULOMATOID MUCOSA ORAL
K135,K13.5 FIBROSE ORAL SUBMUCOSA
K136,K13.6 HIPERPLASIA IRRITATIVA DA MUCOSA ORAL
K911,K91.1 SINDR POS-CIRURGIA GASTRICA
K137,K13.7 OUTR LESOES E AS NE DA MUCOSA ORAL
K14,K14   DOENC DA LINGUA
K140,K14.0 GLOSSITE
K141,K14.1 LINGUA GEOGRAFICA
K142,K14.2 GLOSSITE ROMBOIDE MEDIANA
K143,K14.3 HIPERTROFIA DAS PAPILAS LINGUAIS
K144,K14.4 ATROFIA DAS PAPILAS LINGUAIS
K145,K14.5 LINGUA ESCROTAL
K146,K14.6 GLOSSODINIA
K148,K14.8 OUTR DOENC DA LINGUA
K149,K14.9 DOENC DA LINGUA SOE
K20,K20   ESOFAGITE
K21,K21   DOENC DE REFLUXO GASTROESOFAGICO
K210,K21.0 DOENC DE REFLUXO GASTROESOFAGICO C/ESOFAGITE
K219,K21.9 DOENC DE REFLUXO GASTROESOFAGICO S/ESOFAGITE
K22,K22   OUTR DOENC DO ESOFAGO
K220,K22.0 ACALASIA DO CARDIA
K221,K22.1 ULCERA DO ESOFAGO
K222,K22.2 OBSTRUCAO DO ESOFAGO
K223,K22.3 PERFURACAO DO ESOFAGO
K224,K22.4 DISCINESIA DO ESOFAGO
K225,K22.5 DIVERTICULO DO ESOFAGO ADQUIR
K226,K22.6 SINDR LACERACAO HEMORRAGICA GASTROESOFAGICA
K228,K22.8 OUTR DOENC ESPEC DO ESOFAGO
K229,K22.9 DOENC DO ESOFAGO SOE
K23,K23   TRANST DO ESOFAGO EM DOENC COP
K230,K23.0 ESOFAGITE TUBERC
K231,K23.1 MEGAESOFAGO NA DOENC DE CHAGAS
K238,K23.8 TRANST DO ESOFAGO EM OUTR DOENC COP
K25,K25   ULCERA GASTRICA
K250,K25.0 AGUDA C/HEMORRAGIA
K251,K25.1 AGUDA C/PERFURACAO
K252,K25.2 AGUDA C/HEMORRAGIA E PERFURACAO
K253,K25.3 AGUDA S/HEMORRAGIA OU PERFURACAO
K254,K25.4 CRONICA OU NE C/HEMORRAGIA
K255,K25.5 CRONICA OU NE C/PERFURACAO
K256,K25.6 CRONICA OU NE C/HEMORRAGIA E PERFURACAO
K257,K25.7 CRONICA S/HEMORRAGIA OU PERFURACAO
K259,K25.9 NE COMO AGUDA CRONICA S/HEMORRAGIA PERFUR
K26,K26   ULCERA DUODENAL
K260,K26.0 AGUDA C/HEMORRAGIA
K261,K26.1 AGUDA C/PERFURACAO
K262,K26.2 AGUDA C/HEMORRAGIA E PERFURACAO
K263,K26.3 AGUDA S/HEMORRAGIA OU PERFURACAO
K264,K26.4 CRONICA OU NE C/HEMORRAGIA
K265,K26.5 CRONICA OU NE C/PERFURACAO
K266,K26.6 CRONICA OU NE C/HEMORRAGIA E PERFURACAO
K267,K26.7 CRONICA S/HEMORRAGIA OU PERFURACAO
K269,K26.9 NE COMO AGUDA CRONICA S/HEMORRAGIA PERFUR
K27,K27   ULCERA PEPTICA DE LOCALIZ NE
K270,K27.0 AGUDA C/HEMORRAGIA
K271,K27.1 AGUDA C/PERFURACAO
K272,K27.2 AGUDA C/HEMORRAGIA E PERFURACAO
K273,K27.3 AGUDA S/HEMORRAGIA OU PERFURACAO
K274,K27.4 CRONICA OU NE C/HEMORRAGIA
K275,K27.5 CRONICA OU NE C/PERFURACAO
K276,K27.6 CRONICA OU NE C/HEMORRAGIA E PERFURACAO
K277,K27.7 CRONICA S/HEMORRAGIA OU PERFURACAO
K279,K27.9 NE COMO AGUDA CRONICA S/HEMORRAGIA PERFUR
K28,K28   ULCERA GASTROJEJUNAL
K280,K28.0 AGUDA C/HEMORRAGIA
K281,K28.1 AGUDA C/PERFURACAO
K282,K28.2 AGUDA C/HEMORRAGIA E PERFURACAO
K283,K28.3 AGUDA S/HEMORRAGIA OU PERFURACAO
K284,K28.4 CRONICA OU NE C/HEMORRAGIA
K285,K28.5 CRONICA OU NE C/PERFURACAO
K286,K28.6 CRONICA OU NE C/HEMORRAGIA E PERFURACAO
K287,K28.7 CRONICA S/HEMORRAGIA OU PERFURACAO
K289,K28.9 NE COMO AGUDA CRONICA S/HEMORRAGIA PERFUR
K29,K29   GASTRITE E DUODENITE
K290,K29.0 GASTRITE HEMORRAGICA AGUDA
K291,K29.1 OUTR GASTRITES AGUDAS
K292,K29.2 GASTRITE ALCOOLICA
K293,K29.3 GASTRITE SUPERF CRONICA
K294,K29.4 GASTRITE ATROFICA CRONICA
K295,K29.5 GASTRITE CRONICA SOE
K296,K29.6 OUTR GASTRITES
K297,K29.7 GASTRITE NE
K298,K29.8 DUODENITE
K299,K29.9 GASTRODUODENITE SOE
K30,K30   DISPEPSIA
K31,K31   OUTR DOENC DO ESTOMAGO E DO DUODENO
K310,K31.0 DILATACAO AGUDA DO ESTOMAGO
K311,K31.1 ESTENOSE PILORICA HIPERTROFICA DO ADULTO
K312,K31.2 ESTENOSE E ESTREITAMENTO AMPULHETA ESTOMAGO
K313,K31.3 ESPASMO DO PILORO NCOP
K314,K31.4 DIVERTICULO GASTRICO
K315,K31.5 OBSTRUCAO DO DUODENO
K316,K31.6 FISTULA DO ESTOMAGO E DO DUODENO
K318,K31.8 OUTR DOENC ESPEC DO ESTOMAGO E DO DUODENO
K319,K31.9 DOENC DO ESTOMAGO E DO DUODENO SOE
K35,K35   APENDICITE AGUDA
K350,K35.0 APENDICITE AGUDA C/PERITONITE GENERALIZADA
K351,K35.1 APENDICITE AGUDA C/ABSCESSO PERITONIAL
K359,K35.9 APENDICITE AGUDA SOE
K36,K36   OUTR FORM DE APENDICITE
K37,K37   APENDICITE SOE
K38,K38   OUTR DOENC DO APENDICE
K380,K38.0 HIPERPLASIA DO APENDICE
K381,K38.1 CONCRECOES APENDICULARES
K382,K38.2 DIVERTICULO DO APENDICE
K383,K38.3 FISTULA DO APENDICE
K388,K38.8 OUTR DOENC ESPEC DO APENDICE
K389,K38.9 DOENC DO APENDICE SOE
K40,K40   HERNIA INGUINAL
K400,K40.0 HERNIA INGUINAL BILATERAL C/OBSTR S/GANGRENA
K401,K40.1 HERNIA INGUINAL BILATERAL C/GANGRENA
K402,K40.2 HERNIA INGUINAL BILAT S/OBSTR OU GANGRENA
K403,K40.3 HERNIA INGUINAL UNILAT NE C/OBSTR S/GANGRENA
K404,K40.4 HERNIA INGUINAL UNILATERAL OU NE C/GANGRENA
K409,K40.9 HERNIA INGUINAL UNILAT NE S/OBSTR GANGRENA
K41,K41   HERNIA FEMORAL
K410,K41.0 HERNIA FEMORAL BILATERAL C/OBSTR S/GANGRENA
K411,K41.1 HERNIA FEMORAL BILATERAL C/GANGRENA
K412,K41.2 HERNIA FEMORAL BILATERAL S/OBSTR OU GANGRENA
